Symbol,Name,Last Sale,Net Change,% Change,Market Cap,Country,IPO Year,Volume,Sector,Industry
PGRE,Paramount Group Inc. Common Stock,$5.10,-0.04,-0.778%,1109344794.00,United States,2014,136711,Real Estate,Real Estate Investment Trusts
PGRU,PropertyGuru Group Limited Ordinary Shares,$6.65,0.02,0.302%,1090285023.00,,2022,37160,Technology,EDP Services
PGZ,Principal Real Estate Income Fund Common Shares of Beneficial Interest,$10.41,-0.07,-0.668%,0.00,,2013,12742,Finance,Investment Managers
PH,Parker-Hannifin Corporation Common Stock,$700.6596,-5.8004,-0.821%,90189207098.00,United States,,117298,Industrials,Metal Fabrications
PHD,Pioneer Floating Rate Fund Inc.,$9.82,0.02,0.204%,0.00,United States,2004,8790,Finance,Investment Managers
PHG,Koninklijke Philips N.V. NY Registry Shares,$25.89,-0.07,-0.27%,23466777709.00,Netherlands,,142371,Health Care,Medical Electronics
PHI,PLDT Inc. Sponsored ADR,$21.93,-0.11,-0.499%,4738103146.00,Philippines,,28805,Telecommunications,Telecommunications Equipment
PHIN,PHINIA Inc. Common Stock,$52.505,0.215,0.411%,2208265476.00,United States,2023,30935,Consumer Discretionary,Auto Parts:O.E.M.
PHK,Pimco High Income Fund,$4.9889,-0.0011,-0.022%,0.00,United States,2003,123903,Finance,Finance/Investors Services
PHM,PulteGroup Inc. Common Stock,$130.61,3.13,2.455%,26785783660.00,United States,,194708,Consumer Discretionary,Homebuilding
PHR,Phreesia Inc. Common Stock,$21.94,-0.42,-1.878%,1267545654.00,United States,2019,36737,Consumer Discretionary,Business Services
PHT,Pioneer High Income Fund Inc.,$7.80,-0.01,-0.128%,0.00,United States,,20037,Finance,Investment Managers
PHX,PHX Minerals Inc. Common Stock,$3.445,0.045,1.324%,129121322.00,United States,2003,4573,Energy,Oil & Gas Production
PII,Polaris Inc. Common Stock,$67.81,0.30,0.444%,3781784585.00,United States,,56695,Consumer Discretionary,Industrial Specialties
PIM,Putnam Master Intermediate Income Trust Common Stock,$3.2501,0.0101,0.312%,163328556.00,United States,1988,14864,Finance,Finance Companies
PINE,Alpine Income Property Trust Inc. Common Stock,$17.62,-0.11,-0.62%,251489872.00,United States,2019,8794,Real Estate,Real Estate Investment Trusts
PINS,Pinterest Inc. Class A Common Stock,$29.715,-0.265,-0.884%,20082176335.00,United States,2019,1406819,Technology,Computer Software: Programming Data Processing
PIPR,Piper Sandler Companies Common Stock,$334.88,0.62,0.185%,5954004988.00,United States,,4967,Finance,Investment Bankers/Brokers/Service
PJT,PJT Partners Inc. Class A Common Stock,$159.35,0.48,0.302%,3776925970.00,United States,2015,26923,Finance,Investment Managers
PK,Park Hotels & Resorts Inc. Common Stock ,$15.315,0.205,1.357%,3161086740.00,United States,2016,448818,Consumer Discretionary,Hotels/Resorts
PKE,Park Aerospace Corp. Common Stock,$14.635,-0.195,-1.315%,292140826.00,United States,,6148,Industrials,Military/Government/Technical
PKG,Packaging Corporation of America Common Stock,$235.78,-2.56,-1.074%,21174209225.00,United States,2000,47716,Consumer Discretionary,Containers/Packaging
PKST,Peakstone Realty Trust Common Shares,$13.0007,-0.2293,-1.733%,472994731.00,United States,2023,16784,Real Estate,Real Estate Investment Trusts
PKX,POSCO HOLDINGS INC. American Depositary Shares (Each representing 1/4th of a share of Common Stock),$53.13,1.55,3.005%,16125211512.00,South Korea,1994,86702,Industrials,Steel/Iron Ore
PL,Planet Labs PBC Class A Common Stock,$3.115,0.115,3.833%,914178995.00,United States,2021,2112866,Technology,Radio And Television Broadcasting And Communications Equipment
PLD,Prologis Inc. Common Stock,$115.16,-1.41,-1.21%,106658313000.00,United States,,748551,Real Estate,Real Estate Investment Trusts
PLNT,Planet Fitness Inc. Common Stock,$96.25,-0.58,-0.599%,8142156138.00,United States,2015,147876,Consumer Discretionary,Hotels/Resorts
PLOW,Douglas Dynamics Inc. Common Stock,$25.095,-0.265,-1.045%,579545109.00,United States,2010,6189,Industrials,Construction/Ag Equipment/Trucks
PLTR,Palantir Technologies Inc. Class A Common Stock,$59.33,-1.37,-2.257%,135095359280.00,United States,2020,18474992,Technology,Computer Software: Prepackaged Software
PLYM,Plymouth Industrial REIT Inc. Common Stock,$19.285,-0.265,-1.355%,875330452.00,United States,2017,79494,Real Estate,Real Estate Investment Trusts
PM,Philip Morris International Inc Common Stock,$125.165,-0.075,-0.06%,194610723763.00,United States,,940211,Health Care, Medicinal Chemicals and Botanical Products 
PMF,PIMCO Municipal Income Fund Common Stock,$9.85,-0.04,-0.404%,0.00,United States,2001,14216,Finance,Finance/Investors Services
PML,Pimco Municipal Income Fund II Common Shares of Beneficial Interest,$8.78,0.02,0.228%,0.00,United States,2002,79700,Finance,Investment Managers
PMM,Putnam Managed Municipal Income Trust Common Stock,$6.255,0.025,0.401%,304861250.00,United States,1989,24356,Finance,Investment Managers
PMO,Putnam Municipal Opportunities Trust Common Stock,$10.43,0.08,0.773%,354427744.00,United States,1993,11741,Finance,Finance Companies
PMT,PennyMac Mortgage Investment Trust Common Shares of Beneficial Interest,$13.165,0.055,0.42%,1143524538.00,United States,2009,86438,Real Estate,Real Estate Investment Trusts
PMT^A,PennyMac Mortgage Investment Trust 8.125% Series A Fixed-to-Floating Rate Cumulative Redeemable Preferred Shares of Beneficial Interest,$25.15,0.10,0.399%,,United States,,269,,
PMT^B,PennyMac Mortgage Investment Trust 8.00% Series B Fixed-to-Floating Rate Cumulative Redeemable Preferred Shares of Beneficial Interest,$24.7272,0.0672,0.273%,,United States,,1344,,
PMT^C,PennyMac Mortgage Investment Trust 6.75% Series C Cumulative Redeemable Preferred Shares of Beneficial Interest,$20.77,-0.0899,-0.431%,,United States,,4491,,
PMTU,PennyMac Mortgage Investment Trust 8.50% Senior Notes due 2028,$25.7057,0.1957,0.767%,2232821779.00,United States,2023,206,Real Estate,Real Estate Investment Trusts
PMX,PIMCO Municipal Income Fund III Common Shares of Beneficial Interest,$7.86,0.02,0.255%,0.00,United States,2002,25768,Finance,Trusts Except Educational Religious and Charitable
PNC,PNC Financial Services Group Inc. (The) Common Stock,$209.54,0.24,0.115%,83141999503.00,United States,,196522,Finance,Major Banks
PNF,PIMCO New York Municipal Income Fund Common Stock,$8.025,0.055,0.69%,0.00,United States,2001,16784,Finance,Finance Companies
PNI,Pimco New York Municipal Income Fund II Common Shares of Beneficial Interest,$7.433,0.033,0.446%,0.00,United States,2002,22761,Finance,Trusts Except Educational Religious and Charitable
PNNT,PennantPark Investment Corporation Common Stock,$7.019,0.019,0.271%,458313284.00,United States,2022,89726,Finance,Finance: Consumer Services
PNR,Pentair plc. Ordinary Share,$106.235,-0.085,-0.08%,17553332070.00,Switzerland,,109570,Industrials,Industrial Machinery/Components
PNST,Pinstripes Holdings Inc. Class A Common Stock,$0.84,-0.0599,-6.656%,42772800.00,,2022,9231,Consumer Discretionary,Restaurants
PNW,Pinnacle West Capital Corporation Common Stock,$91.03,-0.19,-0.208%,10350094615.00,United States,,81792,Utilities,Electric Utilities: Central
POR,Portland General Electric Co Common Stock,$46.315,-0.015,-0.032%,4884175651.00,United States,,79092,Utilities,Electric Utilities: Central
POST,Post Holdings Inc. Common Stock,$109.445,-0.025,-0.023%,6394600583.00,United States,2012,50887,Consumer Staples,Packaged Foods
PPG,PPG Industries Inc. Common Stock,$123.555,0.135,0.109%,28664760000.00,United States,,142999,Consumer Discretionary,Paints/Coatings
PPL,PPL Corporation Common Stock,$33.48,-0.01,-0.03%,24707235767.00,United States,,272431,Utilities,Electric Utilities: Central
PPT,Putnam Premier Income Trust Common Stock,$3.54,0.01,0.283%,352330051.00,United States,1988,50247,Finance,Finance Companies
PR,Permian Resources Corporation Class A Common Stock,$15.18,0.05,0.33%,12195069330.00,United States,2022,829500,Energy,Oil & Gas Production
PRA,ProAssurance Corporation Common Stock,$17.215,0.045,0.262%,880655756.00,United States,,16486,Finance,Property-Casualty Insurers
PRG,PROG Holdings Inc. Common Stock,$48.51,-0.33,-0.676%,2015270625.00,United States,,22465,Consumer Discretionary,Diversified Commercial Services
PRGO,Perrigo Company plc Ordinary Shares,$26.49,-0.32,-1.194%,3613972528.00,United States,,155076,Health Care,Biotechnology: Pharmaceutical Preparations
PRH,Prudential Financial Inc. 5.950% Junior Subordinated Notes due 2062,$25.74,-0.07,-0.271%,9163440000.00,United States,2022,4086,Finance,Life Insurance
PRI,Primerica Inc. Common Stock,$298.595,-1.585,-0.528%,9964533183.00,United States,2010,6921,Finance,Life Insurance
PRIF^D,Priority Income Fund Inc. 7.00% Series D Term Preferred Stock due 2029,$24.302,0.022,0.091%,,,,2163,,
PRIF^F,Priority Income Fund Inc. 6.625% Series F Term Preferred Stock due 2027,$24.48,0.00,0.00%,,,,1,,
PRIF^G,Priority Income Fund Inc. 6.25% Series G Preferred Stock Due 2026,$24.44,0.00,0.00%,,,,178,,
PRIF^H,Priority Income Fund Inc. 6.00% Series H Term Preferred Stock due 2026,$24.29,0.41,1.717%,,,,162,,
PRIF^I,Priority Income Fund Inc. 6.125% Series I Term Preferred Stock due 2028,$23.90,0.48,2.05%,,,,175,,
PRIF^J,Priority Income Fund Inc. 6.000% Series J Term Preferred Stock due 2028,$23.29,0.00,0.00%,,,,50,,
PRIF^K,Priority Income Fund Inc. 7.000% Series K Cumulative Preferred Stock,$22.65,-0.5451,-2.35%,,,,3909,,
PRIF^L,Priority Income Fund Inc. 6.375% Series L Term Preferred Stock Due 2029,$23.9613,0.2713,1.145%,,,,104,,
PRIM,Primoris Services Corporation Common Stock,$79.721,0.521,0.658%,4282060770.00,United States,,42526,Industrials,Water Sewer Pipeline Comm & Power Line Construction
PRKS,United Parks & Resorts Inc. Common Stock,$59.61,0.96,1.637%,3278759231.00,United States,2013,196487,Health Care,Biotechnology: Electromedical & Electrotherapeutic Apparatus
PRLB,Proto Labs Inc. Common stock,$38.206,-1.054,-2.685%,936431964.00,United States,2012,12840,Industrials,Metal Fabrications
PRM,Perimeter Solutions SA Ordinary Shares,$12.20,0.10,0.826%,1783981258.00,Luxembourg,2021,143154,Industrials,Major Chemicals
PRMB,Primo Brands Corporation Class A Common Stock,$28.34,0.05,0.177%,0.00,,2024,441252,,
PRO,PROS Holdings Inc. Common Stock,$23.08,-0.25,-1.072%,1091821672.00,United States,2007,43340,Technology,EDP Services
PRS,Prudential Financial Inc. 5.625% Junior Subordinated Notes due 2058,$24.45,-0.12,-0.488%,8704200000.00,United States,2018,7580,Finance,Life Insurance
PRT,PermRock Royalty Trust Trust Units,$3.9377,0.0477,1.226%,47905003.00,United States,2018,4187,Energy,Oil & Gas Production
PRU,Prudential Financial Inc. Common Stock,$126.40,1.14,0.91%,44998400000.00,United States,2001,206194,Finance,Life Insurance
PSA,Public Storage Common Stock,$332.425,-2.515,-0.751%,58210493309.00,United States,,89769,Real Estate,Real Estate Investment Trusts
PSA^F,Public Storage Depositary Shares Each Representing 1/1000 of a 5.15% Cumulative Preferred Share of Beneficial Interest Series F par value $0.01 per share,$23.84,-0.05,-0.209%,,United States,,5092,,
PSA^G,Public Storage Depositary Shares Each Representing 1/1000 of a 5.05% Cumulative Preferred Share of Beneficial Interest Series G,$23.9702,0.1402,0.588%,,United States,,368,,
PSA^H,Public Storage Depositary Shares Each Representing 1/1000 of a  5.60% Cumulative Preferred  Share of Beneficial Interest Series H,$24.90,-0.09,-0.36%,,United States,,2939,,
PSA^I,Public Storage Depositary Shares Each Representing 1/1000 of a 4.875% Cumulative Preferred Share of Beneficial Interest Series I par value $0.01 per share,$22.40,-0.08,-0.356%,,United States,,1411,,
PSA^J,Public Storage Depositary Shares Each Representing 1/1000 of a 4.700% Cumulative Preferred Share of Beneficial Interest Series J par value $0.01 per share,$21.92,0.31,1.435%,,United States,,773,,
PSA^K,Public Storage Depositary Shares Each Representing 1/1000 of a 4.75% Cumulative Preferred Share of Beneficial Interest Series K,$21.49,-0.15,-0.693%,,United States,,1581,,
PSA^L,Public Storage Depositary Shares Each Representing 1/1000 of a 4.625% Cumulative Preferred Share of Beneficial Interest Series L par value $0.01 per share,$21.00,0.05,0.239%,,United States,,10152,,
PSA^M,Public Storage Depositary Shares Each Representing 1/1000 of a 4.125% Cumulative Preferred Share of Beneficial Interest Series M,$19.32,0.15,0.782%,,United States,,193,,
PSA^N,Public Storage Depositary Shares Each Representing 1/1000 of a 3.875% Cumulative Preferred Share of Beneficial Interest Series N,$17.84,-0.07,-0.391%,,United States,,1523,,
PSA^O,Public Storage Depositary Shares Each Representing 1/1000 of a 3.900% Cumulative Preferred Share of Beneficial Interest Series O,$17.70,-0.28,-1.557%,,United States,,2819,,
PSA^P,Public Storage Depositary Shares Each Representing 1/1000 of a 4.000% Cumulative Preferred Share of Bene cial Interest Series P,$18.175,-0.015,-0.082%,,United States,,11920,,
PSA^Q,Public Storage Depositary Shares Each Representing 1/1000 of a 3.950% Cumulative Preferred Share of Beneficial Interest Series Q par value $0.01 per share,$17.9013,-0.2187,-1.207%,,United States,,1018,,
PSA^R,Public Storage Depositary Shares Each Representing 1/1000 of a 4.00% Cumulative Preferred Share of Bene cial Interest Series R,$18.33,-0.20,-1.079%,,United States,,6999,,
PSA^S,Public Storage Depositary Shares Each Representing 1/1000 of a 4.100% Cumulative Preferred Share of Beneficial Interest Series S,$18.90,-0.08,-0.421%,,United States,,2688,,
PSBD,Palmer Square Capital BDC Inc. Common Stock,$16.07,0.11,0.689%,0.00,,2024,329,,
PSEC^A,Prospect Capital Corporation 5.35% Series A Fixed Rate Cumulative Perpetual Preferred Stock,$19.2499,0.3999,2.121%,,United States,,548,,
PSF,Cohen & Steers Select Preferred and Income Fund Inc. Common Stock,$20.2261,-0.0639,-0.315%,993882804.00,,2010,14399,Finance,Investment Managers
PSFE,Paysafe Limited Common Shares,$18.07,-0.95,-4.995%,1115270335.00,,2021,212711,Consumer Discretionary,Business Services
PSN,Parsons Corporation Common Stock,$107.00,-5.01,-4.473%,11362324543.00,United States,2019,287309,Technology,EDP Services
PSO,Pearson Plc Common Stock,$15.14,0.05,0.331%,10086296221.00,United Kingdom,,114363,Consumer Discretionary,Books
PSQH,PSQ Holdings Inc. Class A Common Stock,$2.5021,-0.0479,-1.878%,78544910.00,,2021,39001,Consumer Discretionary,Advertising
PSTG,Pure Storage Inc. Class A Common Stock,$49.82,-0.05,-0.10%,16325610159.00,United States,2015,281431,Technology,Electronic Components
PSTL,Postal Realty Trust Inc. Class A Common Stock,$14.175,-0.195,-1.357%,332451435.00,United States,2019,5096,Real Estate,Real Estate Investment Trusts
PSX,Phillips 66 Common Stock,$129.055,-0.855,-0.658%,53298324690.00,United States,,189234,Energy,Integrated oil Companies
PTA,Cohen & Steers Tax-Advantaged Preferred Securities and Income Fund Common Shares of Beneficial Interest,$19.8983,-0.0317,-0.159%,1099847829.00,United States,2020,27078,Finance,Trusts Except Educational Religious and Charitable
PTY,Pimco Corporate & Income Opportunity Fund,$14.5061,-0.0239,-0.164%,0.00,United States,2002,145807,Finance,Investment Managers
PUK,Prudential Public Limited Company Common Stock,$15.93,0.41,2.642%,21542756224.00,United Kingdom,,229815,Finance,Life Insurance
PUMP,ProPetro Holding Corp. Common Stock,$7.82,-0.04,-0.509%,804910614.00,United States,2017,93635,Energy,Oilfield Services/Equipment
PVH,PVH Corp. Common Stock,$104.19,1.61,1.57%,5815270871.00,United States,,55487,Consumer Discretionary,Apparel
PVL,Permianville Royalty Trust Trust Units ,$1.5789,0.0089,0.567%,52103700.00,United States,2011,4177,Energy,Oil & Gas Production
PWR,Quanta Services Inc. Common Stock,$326.365,-0.515,-0.158%,48175258202.00,United States,,85180,Industrials,Engineering & Construction
PX,P10 Inc. Class A Common Stock,$11.96,0.16,1.356%,1335008150.00,United States,2021,175872,Finance,Investment Managers
PYN,PIMCO New York Municipal Income Fund III Common Shares of Beneficial Interest,$6.06,0.06,1.00%,0.00,United States,2002,9185,Finance,Investment Managers
PYT,PPlus Tr GSC-2 Tr Ctf Fltg Rate,$23.2499,0.1395,0.604%,0.00,United States,,1129,Finance,Finance: Consumer Services
PZC,PIMCO California Municipal Income Fund III Common Shares of Beneficial Interest,$7.1105,0.0105,0.148%,0.00,United States,2002,17275,Finance,Investment Managers
QBTS,D-Wave Quantum Inc. Common Shares,$1.8046,0.0246,1.382%,363499309.00,,2022,14066796,Technology,EDP Services
QD,Qudian Inc. American Depositary Shares each representing one Class A Ordinary Share,$2.3308,0.0008,0.034%,441462496.00,China,2017,94657,Finance,Finance: Consumer Services
QGEN,Qiagen N.V. Common Shares,$42.425,-0.205,-0.481%,9681501881.00,Netherlands,,80892,Health Care,Biotechnology: Biological Products (No Diagnostic Substances)
QS,QuantumScape Corporation Class A Common Stock,$4.92,0.04,0.82%,2521358422.00,United States,2020,2504530,Miscellaneous,Industrial Machinery/Components
QSR,Restaurant Brands International Inc. Common Shares,$67.895,-0.015,-0.022%,21978120713.00,Canada,2014,156760,Consumer Discretionary,Restaurants
QTWO,Q2 Holdings Inc. Common Stock,$99.905,-3.395,-3.287%,6034366700.00,United States,2014,108210,Technology,Computer Software: Prepackaged Software
QUAD,Quad Graphics Inc Class A Common Stock,$7.3319,-0.2281,-3.017%,382130614.00,United States,,36850,Consumer Discretionary,Publishing
QVCC,QVC Inc. 6.250% Senior Secured Notes due 2068,$13.295,0.075,0.567%,13.00,United States,2019,3717,Consumer Discretionary,Catalog/Specialty Distribution
QVCD,QVC Inc. 6.375% Senior Secured Notes due 2067,$13.45,0.00,0.00%,13.00,United States,2018,27,Consumer Discretionary,Catalog/Specialty Distribution
R,Ryder System Inc. Common Stock,$168.66,0.90,0.536%,7132667325.00,United States,,50973,Consumer Discretionary,Rental/Leasing Companies
RA,Brookfield Real Assets Income Fund Inc. Common Stock,$13.159,-0.041,-0.311%,0.00,United States,2016,35960,Finance,Investment Managers
RACE,Ferrari N.V. Common Shares,$440.76,0.87,0.198%,107435674011.00,Italy,2015,37820,Consumer Discretionary,Auto Manufacturing
RAMP,LiveRamp Holdings Inc. Common Stock,$28.56,-0.23,-0.799%,1863948694.00,United States,2018,48834,Technology,EDP Services
RBA,RB Global Inc. Common Stock,$91.70,0.54,0.592%,16896092259.00,Canada,,116093,Consumer Discretionary,Business Services
RBC,RBC Bearings Incorporated Common Stock,$314.94,-0.75,-0.238%,9892063838.00,United States,2022,5255,Industrials,Metal Fabrications
RBLX,Roblox Corporation Class A Common Stock,$53.01,-0.13,-0.245%,34786448659.00,United States,2021,1081080,Technology,Computer Software: Prepackaged Software
RBOT,Vicarious Surgical Inc. Class A Common Stock,$9.425,0.275,3.005%,55582081.00,Hong Kong,2020,6570,Health Care,Industrial Specialties
RBRK,Rubrik Inc. Class A Common Stock,$44.04,-0.54,-1.211%,8000007412.00,United States,2024,125887,Technology,Computer Software: Prepackaged Software
RC,Ready Capital Corporation Common Stock,$7.105,-0.005,-0.07%,1195166431.00,United States,2013,122792,Real Estate,Real Estate Investment Trusts
RC^C,Ready Capital Corporation 6.25% Series C Cumulative Convertible Preferred Stock,$18.50,0.00,0.00%,,United States,,430,,
RC^E,Ready Capital Corporation 6.50% Series E Cumulative Redeemable Preferred Stock,$19.00,0.00,0.00%,,United States,,5674,,
RCB,Ready Capital Corporation 6.20% Senior Notes due 2026,$24.42,0.00,0.00%,4107806368.00,United States,2019,585,Real Estate,Real Estate Investment Trusts
RCC,Ready Capital Corporation 5.75% Senior Notes due 2026,$24.50,-0.068,-0.277%,4121263556.00,United States,2021,5236,Real Estate,Real Estate Investment Trusts
RCI,Rogers Communication Inc. Common Stock,$36.205,0.225,0.625%,19234433721.00,Canada,,54438,Telecommunications,Cable & Other Pay Television Services
RCL,Royal Caribbean Cruises Ltd. Common Stock,$235.24,0.99,0.423%,63250211458.00,United States,1993,182018,Consumer Discretionary,Marine Transportation
RCS,PIMCO Strategic Income Fund Inc.,$7.83,0.03,0.385%,0.00,United States,1994,41303,Finance,Investment Managers
RCUS,Arcus Biosciences Inc. Common Stock,$15.96,-0.47,-2.861%,1460525280.00,United States,2018,44775,Health Care,Biotechnology: Pharmaceutical Preparations
RDDT,Reddit Inc. Class A Common Stock,$131.88,-0.18,-0.136%,23155261588.00,United States,2024,852681,Technology,EDP Services
RDN,Radian Group Inc. Common Stock,$34.73,0.24,0.696%,5172428017.00,United States,,62885,Finance,Property-Casualty Insurers
RDW,Redwire Corporation Common Stock,$10.29,0.02,0.195%,684705563.00,United States,2021,263286,Industrials,Military/Government/Technical
RDY,Dr. Reddy's Laboratories Ltd Common Stock,$14.36,-0.20,-1.374%,11981779083.00,India,,88325,Health Care,Biotechnology: Pharmaceutical Preparations
RELX,RELX PLC PLC American Depositary Shares (Each representing One Ordinary Share),$46.27,0.15,0.325%,86255271245.00,United Kingdom,2015,197527,Consumer Discretionary,Business Services
RERE,ATRenew Inc. American Depositary Shares (every three of which representing two Class A ordinary shares),$2.375,-0.035,-1.452%,526537500.00,Cayman Islands,2021,82371,Consumer Discretionary,Other Specialty Stores
RES,RPC Inc. Common Stock,$5.895,-0.005,-0.085%,1267262009.00,United States,,128405,Energy,Oilfield Services/Equipment
REVG,REV Group Inc. Common Stock,$30.58,0.20,0.658%,1590115690.00,United States,2017,40631,Consumer Discretionary,Auto Manufacturing
REX,REX American Resources Corporation,$46.68,-0.07,-0.15%,820034655.00,United States,,6676,Industrials,Major Chemicals
REXR,Rexford Industrial Realty Inc. Common Stock,$41.44,-0.42,-1.003%,9215913084.00,United States,2013,205648,Real Estate,Real Estate Investment Trusts
REXR^B,Rexford Industrial Realty Inc. 5.875% Series B Cumulative Redeemable Preferred Stock,$23.03,0.00,0.00%,,United States,,45,,
REXR^C,Rexford Industrial Realty Inc. 5.625% Series C Cumulative Redeemable Preferred Stock par value $0.01 per share,$22.51,0.00,0.00%,,United States,,6,,
REZI,Resideo Technologies Inc. Common Stock ,$25.52,0.16,0.631%,3750713930.00,United States,2018,92614,Industrials,Wholesale Distributors
RF,Regions Financial Corporation Common Stock,$26.325,0.225,0.862%,23925838614.00,United States,,1213960,Finance,Major Banks
RF^C,Regions Financial Corporation Depositary Shares each Representing a 1/40th Interest in a  Share of 5.700% Fixed-to-Floating Rate Non-Cumulative  Perpetual Preferred Stock Series C,$24.4175,-0.0425,-0.174%,,United States,,7875,,
RF^E,Regions Financial Corporation Depositary Shares Each Representing a 1/40th Interest in a Share of 4.45% Non-Cumulative Perpetual Preferred Stock Series E,$19.315,-0.015,-0.078%,,United States,,9993,,
RF^F,Regions Financial Corporation Depositary Shares Each Representing a 1/40th Interest in a Share of Non-Cumulative Perpetual Preferred Stock Series F,$25.80,0.02,0.078%,,United States,,2304,,
RFI,Cohen & Steers Total Return Realty Fund Inc. Common Stock,$12.609,0.019,0.151%,619588960.00,United States,1993,5119,Finance,Investment Managers
RFL,Rafael Holdings Inc. Class B Common Stock,$1.8319,0.0319,1.772%,45200575.00,United States,2018,8821,Finance,Real Estate
RFM,RiverNorth Flexible Municipal Income Fund Inc. Common Stock,$15.9903,0.0903,0.568%,97775871.00,,2020,201,Finance,Finance/Investors Services
RFMZ,RiverNorth Flexible Municipal Income Fund II Inc. Common Stock,$14.235,0.035,0.246%,346647247.00,,2021,2145,Finance,Trusts Except Educational Religious and Charitable
RGA,Reinsurance Group of America Incorporated Common Stock,$230.38,0.01,0.004%,15173824345.00,United States,,19699,Finance,Life Insurance
RGR,Sturm Ruger & Company Inc. Common Stock,$39.285,-0.345,-0.871%,659627521.00,United States,,14521,Industrials,Ordnance And Accessories
RGT,Royce Global Trust Inc. Common Stock,$11.58,-0.03,-0.258%,72571200.00,,2013,4811,Finance,Trusts Except Educational Religious and Charitable
RH,RH Common Stock,$327.44,0.89,0.273%,6051974306.00,United States,2012,78922,Consumer Discretionary,Other Specialty Stores
RHI,Robert Half Inc. Common Stock,$76.38,-0.42,-0.547%,7886302520.00,United States,,82785,Consumer Discretionary,Professional Services
RHP,Ryman Hospitality Properties Inc. (REIT),$115.095,1.775,1.566%,6894325046.00,United States,,31211,Real Estate,Real Estate Investment Trusts
RIG,Transocean Ltd (Switzerland) Common Stock,$4.2771,0.0371,0.875%,3745899556.00,Switzerland,,3285729,Energy,Oil & Gas Production
RIO,Rio Tinto Plc Common Stock,$60.4901,-0.1299,-0.214%,75777078165.00,Australia,2002,770264,Basic Materials,Metal Mining
RITM,Rithm Capital Corp. Common Stock,$10.7699,0.0299,0.278%,5597466212.00,United States,,368529,Real Estate,Real Estate Investment Trusts
RITM^A,Rithm Capital Corp. 7.50% Series A Fixed-to-Floating Rate Cumulative Redeemable Preferred Stock,$25.50,0.1358,0.535%,,United States,,815,,
RITM^B,Rithm Capital Corp. 7.125% Series B Fixed-to-Floating Rate Cumulative Redeemable Preferred Stock,$25.33,0.00,0.00%,,United States,,854,,
RITM^C,Rithm Capital Corp. 6.375% Series C Fixed-to-Floating Rate Cumulative Redeemable Preferred Stock,$24.69,0.09,0.366%,,United States,,1789,,
RITM^D,Rithm Capital Corp. 7.00% Fixed-Rate Reset Series D Cumulative Redeemable Preferred Stock,$24.16,0.0001,0.00%,,United States,,2785,,
RIV,RiverNorth Opportunities Fund Inc. Common Stock,$12.5901,0.0101,0.08%,0.00,United States,2015,18410,Finance,Finance Companies
RIV^A,RiverNorth Opportunities Fund Inc. 6.00% Series A Perpetual Preferred Stock,$23.72,0.00,0.00%,,United States,,254,,
RJF,Raymond James Financial Inc. Common Stock,$162.12,1.48,0.921%,33387550493.00,United States,,134881,Finance,Investment Bankers/Brokers/Service
RJF^B,Raymond James Financial Inc. Depositary Shares each representing a 1/40th interest in a share of 6.375% Fixed-to-Floating Rate Series B Non-Cumulative Perpetual Preferred Stock,$25.19,-0.01,-0.04%,,United States,,3598,,
