Symbol,Name,Last Sale,Net Change,% Change,Market Cap,Country,IPO Year,Volume,Sector,Industry
PGZ,Principal Real Estate Income Fund Common Shares of Beneficial Interest,$11.102,-0.088,-0.786%,0.00,,2013,26699,Finance,Investment Managers
PH,Parker-Hannifin Corporation Common Stock,$627.50,-2.64,-0.419%,80693819948.00,United States,,519667,Industrials,Metal Fabrications
PHD,Pioneer Floating Rate Fund Inc.,$9.86,-0.01,-0.101%,0.00,United States,2004,47916,Finance,Investment Managers
PHG,Koninklijke Philips N.V. NY Registry Shares,$32.46,-0.21,-0.643%,29421846444.00,Netherlands,,540467,Health Care,Medical Electronics
PHI,PLDT Inc. Sponsored ADR,$27.45,0.11,0.402%,5930731024.00,Philippines,,16582,Telecommunications,Telecommunications Equipment
PHIN,PHINIA Inc. Common Stock,$46.16,0.60,1.317%,2016167294.00,United States,2023,349543,Consumer Discretionary,Auto Parts:O.E.M.
PHK,Pimco High Income Fund,$5.075,0.015,0.296%,0.00,United States,2003,673347,Finance,Finance/Investors Services
PHM,PulteGroup Inc. Common Stock,$143.30,-1.31,-0.906%,29738193929.00,United States,,1072643,Consumer Discretionary,Homebuilding
PHR,Phreesia Inc. Common Stock,$22.37,0.01,0.045%,1292388162.00,United States,2019,243539,Consumer Discretionary,Business Services
PHT,Pioneer High Income Fund Inc.,$7.93,-0.02,-0.252%,0.00,United States,,119876,Finance,Investment Managers
PHX,PHX Minerals Inc. Common Stock,$3.38,0.00,0.00%,126743166.00,United States,2003,40504,Energy,Oil & Gas Production
PHYT,Pyrophyte Acquisition Corp. Class A Ordinary Shares,$11.54,0.00,0.00%,0.00,,2021,2813,Finance,Blank Checks
PII,Polaris Inc. Common Stock,$81.75,-1.02,-1.232%,4557401616.00,United States,,406680,Consumer Discretionary,Industrial Specialties
PIM,Putnam Master Intermediate Income Trust Common Stock,$3.415,-0.005,-0.146%,171615341.00,United States,1988,49395,Finance,Finance Companies
PINE,Alpine Income Property Trust Inc. Common Stock,$17.70,-0.35,-1.939%,241282099.00,United States,2019,58544,Real Estate,Real Estate Investment Trusts
PINS,Pinterest Inc. Class A Common Stock,$33.21,0.45,1.374%,22788555278.00,United States,2019,6197455,Technology,Computer Software: Programming Data Processing
PIPR,Piper Sandler Companies Common Stock,$283.47,0.90,0.319%,5016590984.00,United States,,52871,Finance,Investment Bankers/Brokers/Service
PJT,PJT Partners Inc. Class A Common Stock,$132.83,-0.28,-0.21%,3160590759.00,United States,2015,106278,Finance,Investment Managers
PK,Park Hotels & Resorts Inc. Common Stock ,$14.10,-0.01,-0.071%,2945733310.00,United States,2016,4980368,Consumer Discretionary,Hotels/Resorts
PKE,Park Aerospace Corp. Common Stock,$12.84,-0.01,-0.078%,260053155.00,United States,,77714,Industrials,Military/Government/Technical
PKG,Packaging Corporation of America Common Stock,$212.81,-2.48,-1.152%,19112851286.00,United States,2000,385650,Consumer Discretionary,Containers/Packaging
PKST,Peakstone Realty Trust Common Shares,$13.46,-0.16,-1.175%,489617501.00,United States,2023,112960,Real Estate,Real Estate Investment Trusts
PKX,POSCO HOLDINGS INC. American Depositary Shares (Each representing 1/4th of a share of Common Stock),$69.80,-0.18,-0.257%,21184636994.00,South Korea,1994,487148,Industrials,Steel/Iron Ore
PL,Planet Labs PBC Class A Common Stock,$2.24,0.04,1.818%,657387143.00,United States,2021,1835608,Technology,Radio And Television Broadcasting And Communications Equipment
PLD,Prologis Inc. Common Stock,$124.18,-0.43,-0.345%,114979627980.00,United States,,3848825,Real Estate,Real Estate Investment Trusts
PLNT,Planet Fitness Inc. Common Stock,$82.54,0.69,0.843%,7029687977.00,United States,2015,906550,Consumer Discretionary,Hotels/Resorts
PLOW,Douglas Dynamics Inc. Common Stock,$27.35,-0.28,-1.013%,631622185.00,United States,2010,66404,Industrials,Construction/Ag Equipment/Trucks
PLTR,Palantir Technologies Inc. Class A Common Stock,$37.49,1.03,2.825%,83957122362.00,United States,2020,34853098,Technology,Computer Software: Prepackaged Software
PLYM,Plymouth Industrial REIT Inc. Common Stock,$22.02,-0.30,-1.344%,999626218.00,United States,2017,237406,Real Estate,Real Estate Investment Trusts
PM,Philip Morris International Inc Common Stock,$119.60,-0.99,-0.821%,185954263466.00,United States,,3425033,Health Care, Medicinal Chemicals and Botanical Products 
PMF,PIMCO Municipal Income Fund Common Stock,$10.19,-0.19,-1.83%,0.00,United States,2001,149503,Finance,Finance/Investors Services
PML,Pimco Municipal Income Fund II Common Shares of Beneficial Interest,$9.43,-0.09,-0.945%,0.00,United States,2002,194284,Finance,Investment Managers
PMM,Putnam Managed Municipal Income Trust Common Stock,$6.48,-0.04,-0.613%,315827482.00,United States,1989,198423,Finance,Investment Managers
PMO,Putnam Municipal Opportunities Trust Common Stock,$10.87,-0.06,-0.549%,369379633.00,United States,1993,103044,Finance,Finance Companies
PMT,PennyMac Mortgage Investment Trust Common Shares of Beneficial Interest,$14.20,-0.05,-0.351%,1233425632.00,United States,2009,649139,Real Estate,Real Estate Investment Trusts
PMT^A,PennyMac Mortgage Investment Trust 8.125% Series A Fixed-to-Floating Rate Cumulative Redeemable Preferred Shares of Beneficial Interest,$24.74,-0.16,-0.643%,,United States,,4430,,
PMT^B,PennyMac Mortgage Investment Trust 8.00% Series B Fixed-to-Floating Rate Cumulative Redeemable Preferred Shares of Beneficial Interest,$24.68,-0.03,-0.121%,,United States,,8458,,
PMT^C,PennyMac Mortgage Investment Trust 6.75% Series C Cumulative Redeemable Preferred Shares of Beneficial Interest,$20.95,-0.13,-0.617%,,United States,,19067,,
PMTU,PennyMac Mortgage Investment Trust 8.50% Senior Notes due 2028,$25.9322,-0.0578,-0.222%,2252495787.00,United States,2023,2949,Real Estate,Real Estate Investment Trusts
PMX,PIMCO Municipal Income Fund III Common Shares of Beneficial Interest,$8.34,-0.18,-2.113%,0.00,United States,2002,165621,Finance,Trusts Except Educational Religious and Charitable
PNC,PNC Financial Services Group Inc. (The) Common Stock,$179.40,-0.49,-0.272%,71310829941.00,United States,,1393969,Finance,Major Banks
PNF,PIMCO New York Municipal Income Fund Common Stock,$8.39,0.07,0.841%,0.00,United States,2001,27272,Finance,Finance Companies
PNI,Pimco New York Municipal Income Fund II Common Shares of Beneficial Interest,$7.85,-0.02,-0.254%,0.00,United States,2002,86392,Finance,Trusts Except Educational Religious and Charitable
PNNT,PennantPark Investment Corporation Common Stock,$6.92,0.05,0.728%,451848970.00,United States,2022,301601,Finance,Finance: Consumer Services
PNR,Pentair plc. Ordinary Share,$95.00,-1.81,-1.87%,15722284920.00,Switzerland,,2629774,Industrials,Industrial Machinery/Components
PNST,Pinstripes Holdings Inc. Class A Common Stock,$0.6825,-0.0455,-6.25%,34752900.00,,2022,16986,Consumer Discretionary,Restaurants
PNW,Pinnacle West Capital Corporation Common Stock,$89.83,-0.68,-0.751%,10205721584.00,United States,,891864,Utilities,Electric Utilities: Central
POR,Portland General Electric Co Common Stock,$47.53,-0.23,-0.482%,4898759443.00,United States,,939279,Utilities,Electric Utilities: Central
POST,Post Holdings Inc. Common Stock,$114.98,-1.13,-0.973%,6717996939.00,United States,2012,329301,Consumer Staples,Packaged Foods
PPG,PPG Industries Inc. Common Stock,$130.68,-0.06,-0.046%,30487644000.00,United States,,858738,Consumer Discretionary,Paints/Coatings
PPL,PPL Corporation Common Stock,$33.06,-0.17,-0.512%,24390785430.00,United States,,4359514,Utilities,Electric Utilities: Central
PPT,Putnam Premier Income Trust Common Stock,$3.72,-0.01,-0.268%,370245138.00,United States,1988,78934,Finance,Finance Companies
PR,Permian Resources Corporation Class A Common Stock,$14.01,0.20,1.448%,11243541801.00,United States,2022,8473439,Energy,Oil & Gas Production
PRA,ProAssurance Corporation Common Stock,$15.01,-0.14,-0.924%,767857309.00,United States,,247433,Finance,Property-Casualty Insurers
PRG,PROG Holdings Inc. Common Stock,$46.85,-0.45,-0.951%,1982785466.00,United States,,340338,Consumer Discretionary,Diversified Commercial Services
PRGO,Perrigo Company plc Ordinary Shares,$25.08,-0.38,-1.493%,3421298683.00,United States,,1344942,Health Care,Biotechnology: Pharmaceutical Preparations
PRH,Prudential Financial Inc. 5.950% Junior Subordinated Notes due 2062,$26.72,0.27,1.021%,9539040000.00,United States,2022,31628,Finance,Life Insurance
PRI,Primerica Inc. Common Stock,$266.16,0.45,0.169%,9003538313.00,United States,2010,106369,Finance,Life Insurance
PRIF^D,Priority Income Fund Inc. 7.00% Series D Term Preferred Stock due 2029,$24.35,-0.04,-0.164%,,,,508,,
PRIF^F,Priority Income Fund Inc. 6.625% Series F Term Preferred Stock due 2027,$24.025,0.00,0.00%,,,,83,,
PRIF^G,Priority Income Fund Inc. 6.25% Series G Preferred Stock Due 2026,$24.47,0.00,0.00%,,,,1,,
PRIF^H,Priority Income Fund Inc. 6.00% Series H Term Preferred Stock due 2026,$23.9001,-0.4499,-1.848%,,,,350,,
PRIF^I,Priority Income Fund Inc. 6.125% Series I Term Preferred Stock due 2028,$23.55,0.11,0.469%,,,,1921,,
PRIF^J,Priority Income Fund Inc. 6.000% Series J Term Preferred Stock due 2028,$23.70,0.0289,0.122%,,,,184,,
PRIF^K,Priority Income Fund Inc. 7.000% Series K Cumulative Preferred Stock,$21.50,0.00,0.00%,,,,2010,,
PRIF^L,Priority Income Fund Inc. 6.375% Series L Term Preferred Stock Due 2029,$23.64,0.17,0.724%,,,,937,,
PRIM,Primoris Services Corporation Common Stock,$57.79,0.73,1.279%,3101747645.00,United States,,300574,Industrials,Water Sewer Pipeline Comm & Power Line Construction
PRKS,United Parks & Resorts Inc. Common Stock,$49.32,-0.01,-0.02%,2858171926.00,United States,2013,617821,Health Care,Biotechnology: Electromedical & Electrotherapeutic Apparatus
PRLB,Proto Labs Inc. Common stock,$28.04,-0.02,-0.071%,705139153.00,United States,2012,170915,Industrials,Metal Fabrications
PRM,Perimeter Solutions SA Ordinary Shares,$13.20,-0.23,-1.713%,1916919550.00,Luxembourg,2021,752996,Industrials,Major Chemicals
PRMW,Primo Water Corporation Common Stock,$24.76,-0.18,-0.722%,3969349533.00,Canada,,811908,Consumer Staples,Beverages (Production/Distribution)
PRO,PROS Holdings Inc. Common Stock,$18.06,0.03,0.166%,852545959.00,United States,2007,440466,Technology,EDP Services
PRS,Prudential Financial Inc. 5.625% Junior Subordinated Notes due 2058,$25.16,-0.01,-0.04%,8982120000.00,United States,2018,18797,Finance,Life Insurance
PRT,PermRock Royalty Trust Trust Units,$3.87,0.04,1.044%,47081383.00,United States,2018,20260,Energy,Oil & Gas Production
PRU,Prudential Financial Inc. Common Stock,$118.95,-0.41,-0.343%,42465150000.00,United States,2001,1151258,Finance,Life Insurance
PSA,Public Storage Common Stock,$355.30,-4.76,-1.322%,62184046403.00,United States,,903245,Real Estate,Real Estate Investment Trusts
PSA^F,Public Storage Depositary Shares Each Representing 1/1000 of a 5.15% Cumulative Preferred Share of Beneficial Interest Series F par value $0.01 per share,$25.03,0.03,0.12%,,United States,,18390,,
PSA^G,Public Storage Depositary Shares Each Representing 1/1000 of a 5.05% Cumulative Preferred Share of Beneficial Interest Series G,$24.87,-0.06,-0.241%,,United States,,43244,,
PSA^H,Public Storage Depositary Shares Each Representing 1/1000 of a  5.60% Cumulative Preferred  Share of Beneficial Interest Series H,$25.05,0.01,0.04%,,United States,,27150,,
PSA^I,Public Storage Depositary Shares Each Representing 1/1000 of a 4.875% Cumulative Preferred Share of Beneficial Interest Series I par value $0.01 per share,$23.51,0.13,0.556%,,United States,,27576,,
PSA^J,Public Storage Depositary Shares Each Representing 1/1000 of a 4.700% Cumulative Preferred Share of Beneficial Interest Series J par value $0.01 per share,$22.77,0.09,0.397%,,United States,,9627,,
PSA^K,Public Storage Depositary Shares Each Representing 1/1000 of a 4.75% Cumulative Preferred Share of Beneficial Interest Series K,$22.87,0.03,0.131%,,United States,,13741,,
PSA^L,Public Storage Depositary Shares Each Representing 1/1000 of a 4.625% Cumulative Preferred Share of Beneficial Interest Series L par value $0.01 per share,$22.27,0.22,0.998%,,United States,,27610,,
PSA^M,Public Storage Depositary Shares Each Representing 1/1000 of a 4.125% Cumulative Preferred Share of Beneficial Interest Series M,$20.22,0.01,0.049%,,United States,,13147,,
PSA^N,Public Storage Depositary Shares Each Representing 1/1000 of a 3.875% Cumulative Preferred Share of Beneficial Interest Series N,$18.75,0.02,0.107%,,United States,,6449,,
PSA^O,Public Storage Depositary Shares Each Representing 1/1000 of a 3.900% Cumulative Preferred Share of Beneficial Interest Series O,$18.77,-0.02,-0.106%,,United States,,6765,,
PSA^P,Public Storage Depositary Shares Each Representing 1/1000 of a 4.000% Cumulative Preferred Share of Bene cial Interest Series P,$19.27,-0.02,-0.104%,,United States,,91475,,
PSA^Q,Public Storage Depositary Shares Each Representing 1/1000 of a 3.950% Cumulative Preferred Share of Beneficial Interest Series Q par value $0.01 per share,$19.19,0.18,0.947%,,United States,,14237,,
PSA^R,Public Storage Depositary Shares Each Representing 1/1000 of a 4.00% Cumulative Preferred Share of Bene cial Interest Series R,$19.65,-0.03,-0.152%,,United States,,15816,,
PSA^S,Public Storage Depositary Shares Each Representing 1/1000 of a 4.100% Cumulative Preferred Share of Beneficial Interest Series S,$20.00,-0.01,-0.05%,,United States,,16304,,
PSBD,Palmer Square Capital BDC Inc. Common Stock,$15.92,-0.18,-1.118%,0.00,,2024,9398,,
PSEC^A,Prospect Capital Corporation 5.35% Series A Fixed Rate Cumulative Perpetual Preferred Stock,$19.91,0.34,1.737%,,United States,,7180,,
PSF,Cohen & Steers Select Preferred and Income Fund Inc. Common Stock,$21.43,-0.07,-0.326%,1053040798.00,,2010,21651,Finance,Investment Managers
PSFE,Paysafe Limited Common Shares,$21.60,-0.29,-1.325%,1333139969.00,,2021,142145,Consumer Discretionary,Business Services
PSN,Parsons Corporation Common Stock,$105.49,0.69,0.658%,11201469575.00,United States,2019,580960,Technology,EDP Services
PSO,Pearson Plc Common Stock,$13.51,-0.07,-0.515%,8999799079.00,United Kingdom,,319174,Consumer Discretionary,Books
PSQH,PSQ Holdings Inc. Class A Common Stock,$2.30,-0.02,-0.862%,72200669.00,,2021,55864,Consumer Discretionary,Advertising
PSTG,Pure Storage Inc. Class A Common Stock,$49.92,1.15,2.358%,16358379348.00,United States,2015,2283273,Technology,Electronic Components
PSTL,Postal Realty Trust Inc. Class A Common Stock,$14.51,-0.03,-0.206%,334213560.00,United States,2019,146011,Real Estate,Real Estate Investment Trusts
PSX,Phillips 66 Common Stock,$134.47,1.48,1.113%,56284998038.00,United States,,1925613,Energy,Integrated oil Companies
PTA,Cohen & Steers Tax-Advantaged Preferred Securities and Income Fund Common Shares of Beneficial Interest,$21.13,0.06,0.285%,1167928146.00,United States,2020,111358,Finance,Trusts Except Educational Religious and Charitable
PTY,Pimco Corporate & Income Opportunity Fund,$14.43,0.01,0.069%,0.00,United States,2002,423944,Finance,Investment Managers
PUK,Prudential Public Limited Company Common Stock,$18.99,0.51,2.76%,25900348598.00,United Kingdom,,2222642,Finance,Life Insurance
PUMP,ProPetro Holding Corp. Common Stock,$7.98,0.02,0.251%,831214172.00,United States,2017,980443,Energy,Oilfield Services/Equipment
PVH,PVH Corp. Common Stock,$94.91,-2.73,-2.796%,5297316041.00,United States,,876701,Consumer Discretionary,Apparel
PVL,Permianville Royalty Trust Trust Units ,$1.58,0.01,0.637%,52140000.00,United States,2011,18558,Energy,Oil & Gas Production
PWR,Quanta Services Inc. Common Stock,$299.09,3.04,1.027%,44064863601.00,United States,,545140,Industrials,Engineering & Construction
PX,P10 Inc. Class A Common Stock,$10.75,-0.04,-0.371%,1200548154.00,United States,2021,545172,Finance,Investment Managers
PYN,PIMCO New York Municipal Income Fund III Common Shares of Beneficial Interest,$6.29,-0.02,-0.317%,0.00,United States,2002,17696,Finance,Investment Managers
PYT,PPlus Tr GSC-2 Tr Ctf Fltg Rate,$23.225,-0.175,-0.748%,0.00,United States,,2512,Finance,Finance: Consumer Services
PZC,PIMCO California Municipal Income Fund III Common Shares of Beneficial Interest,$7.62,0.01,0.131%,0.00,United States,2002,83787,Finance,Investment Managers
QBTS,D-Wave Quantum Inc. Common Shares,$0.9182,-0.0018,-0.196%,184952381.00,,2022,1303864,Technology,EDP Services
QD,Qudian Inc. American Depositary Shares each representing one Class A Ordinary Share,$2.28,0.14,6.542%,431840780.00,China,2017,2415076,Finance,Finance: Consumer Services
QGEN,Qiagen N.V. Common Shares,$44.35,-0.56,-1.247%,10120792184.00,Netherlands,,1394213,Health Care,Biotechnology: Biological Products (No Diagnostic Substances)
QS,QuantumScape Corporation Class A Common Stock,$5.55,0.18,3.352%,2808930330.00,United States,2020,5565274,Miscellaneous,Industrial Machinery/Components
QSR,Restaurant Brands International Inc. Common Shares,$72.41,-0.08,-0.11%,32628069314.00,Canada,2014,1024478,Consumer Discretionary,Restaurants
QTWO,Q2 Holdings Inc. Common Stock,$78.55,0.72,0.925%,4735243161.00,United States,2014,228591,Technology,Computer Software: Prepackaged Software
QUAD,Quad Graphics Inc Class A Common Stock,$4.80,0.13,2.784%,250373088.00,United States,,165862,Consumer Discretionary,Publishing
QVCC,QVC Inc. 6.250% Senior Secured Notes due 2068,$13.23,-0.12,-0.899%,13.00,United States,2019,9542,Consumer Discretionary,Catalog/Specialty Distribution
QVCD,QVC Inc. 6.375% Senior Secured Notes due 2067,$13.3601,-0.0499,-0.372%,13.00,United States,2018,4077,Consumer Discretionary,Catalog/Specialty Distribution
R,Ryder System Inc. Common Stock,$143.35,-0.88,-0.61%,6204644283.00,United States,,152574,Consumer Discretionary,Rental/Leasing Companies
RA,Brookfield Real Assets Income Fund Inc. Common Stock,$13.68,0.01,0.073%,0.00,United States,2016,206569,Finance,Investment Managers
RACE,Ferrari N.V. Common Shares,$457.16,1.30,0.285%,111433189788.00,Italy,2015,287217,Consumer Discretionary,Auto Manufacturing
RAMP,LiveRamp Holdings Inc. Common Stock,$24.10,0.04,0.166%,1605340669.00,United States,2018,314207,Technology,EDP Services
RBA,RB Global Inc. Common Stock,$80.01,-0.03,-0.037%,14742162940.00,Canada,,780323,Consumer Discretionary,Business Services
RBC,RBC Bearings Incorporated Common Stock,$297.66,-4.55,-1.506%,8700561021.00,United States,2022,158029,Industrials,Metal Fabrications
RBCP,RBC Bearings Incorporated 5.00% Series A Mandatory Convertible Preferred Stock,$131.50,-1.71,-1.284%,3843726985.00,United States,2022,91542,Industrials,Metal Fabrications
RBLX,Roblox Corporation Class A Common Stock,$43.39,-0.14,-0.322%,28082008000.00,United States,2021,6510497,Technology,Computer Software: Prepackaged Software
RBOT,Vicarious Surgical Inc. Class A Common Stock,$5.63,0.20,3.683%,33201816.00,Hong Kong,2020,10162,Health Care,Industrial Specialties
RBRK,Rubrik Inc. Class A Common Stock,$31.39,0.03,0.096%,5702094293.00,United States,2024,1326678,Technology,Computer Software: Prepackaged Software
RC,Ready Capital Corproation Common Stock,$7.38,-0.06,-0.806%,1241425512.00,United States,2013,1416481,Real Estate,Real Estate Investment Trusts
RC^C,Ready Capital Corporation 6.25% Series C Cumulative Convertible Preferred Stock,$19.32,-0.53,-2.67%,,United States,,3373,,
RC^E,Ready Capital Corporation 6.50% Series E Cumulative Redeemable Preferred Stock,$19.32,0.10,0.52%,,United States,,8205,,
RCB,Ready Capital Corporation 6.20% Senior Notes due 2026,$24.52,-0.01,-0.041%,4124627852.00,United States,2019,2779,Real Estate,Real Estate Investment Trusts
RCC,Ready Capital Corporation 5.75% Senior Notes due 2026,$24.46,-0.02,-0.082%,4114534962.00,United States,2021,1000,Real Estate,Real Estate Investment Trusts
RCFA,Perception Capital Corp. IV Class A Ordinary Shares,$11.455,-0.005,-0.044%,0.00,,2021,80000,Finance,Blank Checks
RCI,Rogers Communication Inc. Common Stock,$39.16,-0.22,-0.559%,20804320522.00,Canada,,985027,Telecommunications,Cable & Other Pay Television Services
RCL,Royal Caribbean Cruises Ltd. Common Stock,$174.96,1.73,0.999%,45038262861.00,United States,1993,1067534,Consumer Discretionary,Marine Transportation
RCS,PIMCO Strategic Income Fund Inc.,$7.71,0.00,0.00%,0.00,United States,1994,175268,Finance,Investment Managers
RCUS,Arcus Biosciences Inc. Common Stock,$15.39,-0.03,-0.195%,1407069302.00,United States,2018,516378,Health Care,Biotechnology: Pharmaceutical Preparations
RDDT,Reddit Inc. Class A Common Stock,$67.78,1.81,2.744%,11243078940.00,,2024,3990841,Technology,EDP Services
RDN,Radian Group Inc. Common Stock,$34.37,0.13,0.38%,5169896046.00,United States,,679043,Finance,Property-Casualty Insurers
RDW,Redwire Corporation Common Stock,$6.80,0.39,6.084%,452441652.00,United States,2021,320245,Industrials,Military/Government/Technical
RDY,Dr. Reddy's Laboratories Ltd Common Stock,$79.29,-0.36,-0.452%,13227020311.00,India,,143171,Health Care,Biotechnology: Pharmaceutical Preparations
RELX,RELX PLC PLC American Depositary Shares (Each representing One Ordinary Share),$47.29,-0.05,-0.106%,88223359397.00,United Kingdom,2015,1590425,Consumer Discretionary,Business Services
RERE,ATRenew Inc. American Depositary Shares (every three of which representing two Class A ordinary shares),$2.90,0.07,2.473%,642930000.00,Cayman Islands,2021,3941758,Consumer Discretionary,Other Specialty Stores
RES,RPC Inc. Common Stock,$6.57,-0.04,-0.605%,1412608893.00,United States,,1348362,Energy,Oilfield Services/Equipment
REVG,REV Group Inc. Common Stock,$27.56,0.35,1.286%,1433080066.00,United States,2017,448448,Consumer Discretionary,Auto Manufacturing
REX,REX American Resources Corporation,$45.54,-0.14,-0.306%,800008102.00,United States,,64471,Industrials,Major Chemicals
REXR,Rexford Industrial Realty Inc. Common Stock,$48.92,-0.53,-1.072%,10737535627.00,United States,2013,1192859,Real Estate,Real Estate Investment Trusts
REXR^B,Rexford Industrial Realty Inc. 5.875% Series B Cumulative Redeemable Preferred Stock,$24.57,0.17,0.697%,,United States,,3840,,
REXR^C,Rexford Industrial Realty Inc. 5.625% Series C Cumulative Redeemable Preferred Stock par value $0.01 per share,$24.20,-0.06,-0.247%,,United States,,5894,,
REZI,Resideo Technologies Inc. Common Stock ,$19.58,0.06,0.307%,2866754126.00,United States,2018,608092,Industrials,Wholesale Distributors
RF,Regions Financial Corporation Common Stock,$22.56,0.02,0.089%,20645217248.00,United States,,8778655,Finance,Major Banks
RF^C,Regions Financial Corporation Depositary Shares each Representing a 1/40th Interest in a  Share of 5.700% Fixed-to-Floating Rate Non-Cumulative  Perpetual Preferred Stock Series C,$25.18,0.07,0.279%,,United States,,76517,,
RF^E,Regions Financial Corporation Depositary Shares Each Representing a 1/40th Interest in a Share of 4.45% Non-Cumulative Perpetual Preferred Stock Series E,$19.22,0.04,0.209%,,United States,,35194,,
RF^F,Regions Financial Corporation Depositary Shares Each Representing a 1/40th Interest in a Share of Non-Cumulative Perpetual Preferred Stock Series F,$26.11,0.06,0.23%,,United States,,127249,,
RFI,Cohen & Steers Total Return Realty Fund Inc. Common Stock,$12.95,-0.06,-0.461%,636345233.00,United States,1993,47003,Finance,Investment Managers
RFL,Rafael Holdings Inc. Class B Common Stock,$1.98,0.02,1.02%,48641999.00,United States,2018,20150,Finance,Real Estate
RFM,RiverNorth Flexible Municipal Income Fund Inc. Common Stock,$16.37,-0.0428,-0.261%,100097623.00,,2020,5469,Finance,Finance/Investors Services
RFMZ,RiverNorth Flexible Municipal Income Fund II Inc. Common Stock,$14.54,0.00,0.00%,354074532.00,,2021,102736,Finance,Trusts Except Educational Religious and Charitable
RGA,Reinsurance Group of America Incorporated Common Stock,$217.63,0.59,0.272%,14332599934.00,United States,,235870,Finance,Life Insurance
RGR,Sturm Ruger & Company Inc. Common Stock,$41.03,-0.55,-1.323%,691566763.00,United States,,67436,Industrials,Ordnance And Accessories
RGT,Royce Global Trust Inc. Common Stock,$11.6451,0.0451,0.389%,72979178.00,,2013,4017,Finance,Trusts Except Educational Religious and Charitable
RH,RH Common Stock,$334.42,0.71,0.213%,6180983531.00,United States,2012,468503,Consumer Discretionary,Other Specialty Stores
RHI,Robert Half Inc. Common Stock,$66.66,-0.29,-0.433%,6936406823.00,United States,,769554,Consumer Discretionary,Professional Services
RHP,Ryman Hospitality Properties Inc. (REIT),$108.19,1.18,1.103%,6480584354.00,United States,,355233,Real Estate,Real Estate Investment Trusts
RIG,Transocean Ltd (Switzerland) Common Stock,$4.33,-0.06,-1.367%,3790785962.00,Switzerland,,17172186,Energy,Oil & Gas Production
RIO,Rio Tinto Plc Common Stock,$70.82,-0.34,-0.478%,88715057934.00,Australia,2002,4744187,Basic Materials,Metal Mining
RITM,Rithm Capital Corp. Common Stock,$10.85,-0.09,-0.823%,5313596779.00,United States,,4962992,Real Estate,Real Estate Investment Trusts
RITM^A,Rithm Capital Corp. 7.50% Series A Fixed-to-Floating Rate Cumulative Redeemable Preferred Stock,$25.7105,0.1306,0.511%,,United States,,17130,,
RITM^B,Rithm Capital Corp. 7.125% Series B Fixed-to-Floating Rate Cumulative Redeemable Preferred Stock,$25.50,-0.03,-0.118%,,United States,,35122,,
RITM^C,Rithm Capital Corp. 6.375% Series C Fixed-to-Floating Rate Cumulative Redeemable Preferred Stock,$24.28,0.00,0.00%,,United States,,13660,,
RITM^D,Rithm Capital Corp. 7.00% Fixed-Rate Reset Series D Cumulative Redeemable Preferred Stock,$24.34,-0.06,-0.246%,,United States,,19634,,
RIV,RiverNorth Opportunities Fund Inc. Common Stock,$12.88,0.09,0.704%,0.00,United States,2015,40086,Finance,Finance Companies
RIV^A,RiverNorth Opportunities Fund Inc. 6.00% Series A Perpetual Preferred Stock,$24.6029,-0.0376,-0.153%,,United States,,5236,,
RJF,Raymond James Financial Inc. Common Stock,$123.84,0.84,0.683%,25504035610.00,United States,,1038973,Finance,Investment Bankers/Brokers/Service
