Symbol,Name,Last Sale,Net Change,% Change,Market Cap,Country,IPO Year,Volume,Sector,Industry
KKR,KKR & Co. Inc. Common Stock,$132.22,2.35,1.81%,117337300801.00,United States,,2118724,Finance,Investment Managers
KKRS,KKR Group Finance Co. IX LLC 4.625% Subordinated Notes due 2061,$20.68,-0.01,-0.048%,18352256698.00,United States,2021,16721,,
KLG,WK Kellogg Co Common Stock,$16.95,-0.27,-1.568%,1456029391.00,United States,2023,573059,Consumer Staples,Packaged Foods
KMB,Kimberly-Clark Corporation Common Stock,$141.76,-0.65,-0.456%,47745395572.00,United States,,1587555,Consumer Discretionary,Containers/Packaging
KMI,Kinder Morgan Inc. Common Stock,$22.94,0.35,1.549%,50914472388.00,United States,2011,15220013,Utilities,Natural Gas Distribution
KMPB,Kemper Corporation 5.875% Fixed-Rate Reset Junior Subordinated Debentures due 2062,$23.64,0.22,0.939%,1523047023.00,United States,2022,4264,Finance,Property-Casualty Insurers
KMPR,Kemper Corporation,$60.84,0.11,0.181%,3919720002.00,United States,,210018,Finance,Property-Casualty Insurers
KMT,Kennametal Inc. Common Stock,$25.52,-0.16,-0.623%,1988028186.00,United States,,390183,Industrials,Industrial Machinery/Components
KMX,CarMax Inc,$75.43,-2.74,-3.505%,11685943042.00,United States,,1681313,Consumer Discretionary,Retail-Auto Dealers and Gas Stations
KN,Knowles Corporation Common Stock,$17.68,0.38,2.197%,1563394363.00,United States,2014,560451,Consumer Staples,Consumer Electronics/Appliances
KNF,Knife Riv Holding Co. Common Stock,$88.14,-0.35,-0.396%,4989843819.00,United States,2023,318365,Industrials,Mining & Quarrying of Nonmetallic Minerals (No Fuels)
KNOP,KNOT Offshore Partners LP Common Units representing Limited Partner Interests,$6.75,0.01,0.148%,229804297.00,United Kingdom,2013,66704,Consumer Discretionary,Marine Transportation
KNSL,Kinsale Capital Group Inc. Common Stock,$476.12,-0.12,-0.025%,11087131719.00,United States,,185174,Finance,Property-Casualty Insurers
KNTK,Kinetik Holdings Inc. Class A Common Stock,$46.72,0.81,1.764%,7359282915.00,United States,2022,454916,Utilities,Natural Gas Distribution
KNX,Knight-Swift Transportation Holdings Inc.,$52.02,-0.72,-1.365%,8420165280.00,United States,2017,1446054,Industrials,Trucking Freight/Courier Services
KO,Coca-Cola Company (The) Common Stock,$71.01,-0.70,-0.976%,306043737332.00,United States,,11152804,Consumer Staples,Beverages (Production/Distribution)
KODK,Eastman Kodak Company Common New,$4.77,0.15,3.247%,383031000.00,United States,,603538,Consumer Discretionary,Industrial Machinery/Components
KOF,Coca Cola Femsa S.A.B. de C.V.  American Depositary Shares each representing 10 Units (each Unit consists of 3 Series B Shares and 5 Series L Shares),$89.24,-0.12,-0.134%,18747827088.00,Mexico,1993,147683,Consumer Staples,Beverages (Production/Distribution)
KOP,Koppers Holdings Inc. Common Stock,$35.70,-1.03,-2.804%,732538867.00,United States,2006,107371,Basic Materials,Forest Products
KORE,KORE Group Holdings Inc. Common Stock,$2.29,0.15,7.009%,41432475.00,United States,,9259,Telecommunications,Telecommunications Equipment
KOS,Kosmos Energy Ltd. Common Shares (DE),$4.27,0.01,0.235%,2014657185.00,Bermuda,2011,7505634,Energy,Oil & Gas Production
KR,Kroger Company (The) Common Stock,$56.09,-0.62,-1.093%,40580345333.00,United States,,3872623,Consumer Staples,Food Chains
KRC,Kilroy Realty Corporation Common Stock,$37.85,-0.42,-1.097%,4443030993.00,United States,1997,649957,Real Estate,Real Estate Investment Trusts
KREF,KKR Real Estate Finance Trust Inc. Common Stock,$11.91,-0.07,-0.584%,825758507.00,United States,2017,251250,Real Estate,Real Estate Investment Trusts
KREF^A,KKR Real Estate Finance Trust Inc. 6.50% Series A Cumulative Redeemable Preferred Stock,$21.26,-0.05,-0.235%,,United States,,10560,,
KRG,Kite Realty Group Trust Common Stock,$26.04,-0.22,-0.838%,5720093240.00,United States,2004,2002835,Real Estate,Real Estate Investment Trusts
KRO,Kronos Worldwide Inc Common Stock,$12.15,-0.15,-1.22%,1397691239.00,United States,,118315,Industrials,Major Chemicals
KRP,Kimbell Royalty Partners Common Units Representing Limited Partner Interests,$16.11,0.06,0.374%,1538404651.00,United States,2017,303898,Energy,Oil & Gas Production
KSM,DWS Strategic Municipal Income Trust,$10.2035,0.0035,0.034%,0.00,United States,1989,12400,Finance,Trusts Except Educational Religious and Charitable
KSS,Kohl's Corporation Common Stock,$19.50,-1.21,-5.843%,2169149873.00,United States,1992,7268313,Consumer Discretionary,Department/Specialty Retail Stores
KT,KT Corporation Common Stock,$14.96,-0.32,-2.094%,7372689586.00,South Korea,,868249,Telecommunications,Telecommunications Equipment
KTB,Kontoor Brands Inc. Common Stock ,$80.15,-1.29,-1.584%,4463174310.00,United States,2019,243577,Consumer Discretionary,Apparel
KTF,DWS Municipal Income Trust,$10.01,0.025,0.25%,395404389.00,United States,1988,208449,Finance,Finance Companies
KTH,Structures Products Cp 8% CorTS Issued by Peco Energy Cap Tr II Preferred Stock,$28.91,0.1899,0.661%,0.00,United States,,5206,Finance,Finance: Consumer Services
KTN,Structured Products Corp 8.205% CorTS 8.205% Corporate Backed Trust Securities (CorTS),$27.55,0.38,1.399%,0.00,United States,,11645,Finance,Finance: Consumer Services
KUKE,Kuke Music Holding Limited American Depositary Shares each representing one Ordinary Share,$0.813,0.0338,4.338%,27033651.00,,2021,75245,Real Estate,Other Consumer Services
KVUE,Kenvue Inc. Common Stock,$22.63,-0.15,-0.658%,43340237266.00,United States,2023,16504884,Consumer Discretionary,Specialty Chemicals
KVYO,Klaviyo Inc. Series A Common Stock,$34.74,-0.74,-2.086%,9264211196.00,United States,2023,828348,Technology,Computer Software: Prepackaged Software
KW,Kennedy-Wilson Holdings Inc. Common Stock,$10.99,0.24,2.233%,1510157034.00,United States,,552309,Finance,Real Estate
KWR,Quaker Houghton Common Stock,$163.60,0.29,0.178%,2930428558.00,United States,,54994,Industrials,Major Chemicals
KYN,Kayne Anderson Energy Infrastructure Fund Inc.,$11.32,0.14,1.252%,1541008920.00,United States,2004,375208,Finance,Finance/Investors Services
L,Loews Corporation Common Stock,$78.62,-0.68,-0.858%,17258388173.00,United States,,750170,Finance,Property-Casualty Insurers
LAAC,Lithium Americas (Argentina) Corp. Common Shares,$3.22,0.00,0.00%,519386000.00,Canada,2023,1223661,,
LAC,Lithium Americas Corp. Common Shares,$2.59,0.02,0.778%,417767000.00,Canada,2023,3470895,Basic Materials,Metal Mining
LAD,Lithia Motors Inc. Common Stock,$307.19,-10.08,-3.177%,8214222201.00,United States,,183125,Consumer Discretionary,Retail-Auto Dealers and Gas Stations
LADR,Ladder Capital Corp Class A Common Stock,$11.30,-0.03,-0.265%,1444887009.00,United States,2014,635051,Real Estate,Real Estate Investment Trusts
LANV,Lanvin Group Holdings Limited Ordinary Shares,$1.73,0.03,1.765%,226579951.00,Cayman Islands,2022,11238,Finance,Blank Checks
LAW,CS Disco Inc. Common Stock,$5.82,-0.01,-0.172%,346176149.00,United States,2021,81682,Technology,Computer Software: Prepackaged Software
LAZ,Lazard Inc. Common Stock,$48.64,-0.52,-1.058%,4385868800.00,Bermuda,2005,471700,Finance,Investment Managers
LB,LandBridge Company LLC Class A Shares Representing Limited Liability Company Interests,$43.58,-0.55,-1.246%,3187946859.00,,2024,353346,Energy,Oil & Gas Production
LBRT,Liberty Energy Inc. Class A common stock,$19.79,-0.15,-0.752%,3271927226.00,United States,2018,1190350,Energy,Oilfield Services/Equipment
LC,LendingClub Corporation Common Stock,$11.23,0.08,0.717%,1255702563.00,United States,2014,868731,Finance,Finance: Consumer Services
LCII,LCI Industries,$120.12,-1.13,-0.932%,3058518863.00,United States,1995,167501,Consumer Discretionary,Auto Parts:O.E.M.
LDI,loanDepot Inc. Class A Common Stock,$2.73,0.04,1.487%,887670513.00,United States,2021,366362,Finance,Finance: Consumer Services
LDOS,Leidos Holdings Inc. Common Stock,$165.20,0.19,0.115%,22254702579.00,United States,,635532,Technology,EDP Services
LDP,Cohen & Steers Limited Duration Preferred and Income Fund Inc.,$21.79,-0.02,-0.092%,0.00,United States,2012,46574,Finance,Finance Companies
LEA,Lear Corporation Common Stock,$108.23,0.11,0.102%,6088661018.00,United States,,497867,Consumer Discretionary,Auto Parts:O.E.M.
LEG,Leggett & Platt Incorporated Common Stock,$13.49,-0.18,-1.317%,1809903549.00,United States,,1108562,Consumer Discretionary,Home Furnishings
LEN,Lennar Corporation Class A Common Stock,$187.11,-1.19,-0.632%,51381163983.00,United States,,1707933,Consumer Discretionary,Homebuilding
LEO,BNY Mellon Strategic Municipals Inc. Common Stock,$6.60,-0.01,-0.151%,411119636.00,United States,1987,161785,Finance,Trusts Except Educational Religious and Charitable
LEV,The Lion Electric Company Common Shares,$0.66,-0.0205,-3.012%,149302503.00,Canada,2021,240512,Consumer Discretionary,Auto Manufacturing
LEVI,Levi Strauss & Co Class A Common Stock,$21.06,-0.62,-2.86%,8371415054.00,United States,2019,6039353,Consumer Discretionary,Apparel
LFT,Lument Finance Trust Inc. Common Stock,$2.45,-0.05,-2.00%,128074314.00,United States,2013,81267,Real Estate,Real Estate Investment Trusts
LFT^A,Lument Finance Trust Inc. 7.875% Series A Cumulative Redeemable Preferred Stock,$22.4255,0.4255,1.934%,,United States,,3839,,
LGI,Lazard Global Total Return and Income Fund Common Stock,$17.81,-0.15,-0.835%,0.00,United States,2004,33839,,
LH,Labcorp Holdings Inc. Common Stock,$219.00,-0.20,-0.091%,18387957663.00,United States,,284373,Health Care,Medical Specialities
LHX,L3Harris Technologies Inc. Common Stock,$244.66,-0.63,-0.257%,46413271785.00,United States,,686315,Industrials,Industrial Machinery/Components
LICY,Li-Cycle Holdings Corp. Common Shares,$1.98,-0.12,-5.714%,44550420.00,Canada,2021,298408,Industrials,Environmental Services
LII,Lennox International Inc. Common Stock,$592.09,-4.54,-0.761%,21098591309.00,United States,1999,269812,Industrials,Industrial Machinery/Components
LITB,LightInTheBox Holding Co. Ltd. American Depositary Shares each representing twelve ordinary shares,$2.66,0.00,0.00%,48902940.00,China,,8411,Consumer Discretionary,Catalog/Specialty Distribution
LLAP,Terran Orbital Corporation Common Stock,$0.2477,-0.0024,-0.96%,50618861.00,United States,2021,3765456,Industrials,Military/Government/Technical
LLY,Eli Lilly and Company Common Stock,$891.07,6.59,0.745%,846895898002.00,United States,,1750180,Health Care,Biotechnology: Pharmaceutical Preparations
LMND,Lemonade Inc. Common Stock,$16.32,0.17,1.053%,1159176095.00,United States,2020,1317287,Finance,Property-Casualty Insurers
LMT,Lockheed Martin Corporation Common Stock,$603.20,-2.66,-0.439%,143777547410.00,United States,,1192124,Industrials,Military/Government/Technical
LNC,Lincoln National Corporation Common Stock,$30.61,-0.29,-0.939%,5209733476.00,United States,,2506563,Finance,Life Insurance
LNC^D,Lincoln National Corporation Depositary Shares Each Representing a 1/1000th Interest in a Share of 9.000% Non-Cumulative Preferred Stock Series D,$28.38,0.05,0.176%,,United States,,32343,,
LND,Brasilagro Brazilian Agric Real Estate Co Sponsored ADR (Brazil),$4.70,0.06,1.293%,481171938.00,Brazil,,15792,Consumer Staples,Farming/Seeds/Milling
LNG,Cheniere Energy Inc. Common Stock,$184.51,3.21,1.771%,41749656877.00,United States,2001,1187769,Utilities,Oil/Gas Transmission
LNN,Lindsay Corporation Common Stock,$123.87,-0.23,-0.185%,1348458606.00,United States,,26121,Industrials,Industrial Machinery/Components
LOAR,Loar Holdings Inc. Common Stock,$73.22,1.39,1.935%,6568095469.00,,2024,275034,Industrials,Military/Government/Technical
LOB,Live Oak Bancshares Inc. Common Stock,$45.94,-0.08,-0.174%,2068921177.00,United States,2022,108152,Finance,Major Banks
LOCL,Local Bounti Corporation Common Stock,$2.57,0.01,0.391%,22214646.00,,2021,15158,Consumer Staples,Farming/Seeds/Milling
LOMA,Loma Negra Compania Industrial Argentina Sociedad Anonima ADS,$8.09,0.05,0.622%,944075737.00,Argentina,2017,331549,Industrials,Building Materials
LOW,Lowe's Companies Inc. Common Stock,$271.86,-0.78,-0.286%,154224592784.00,United States,,2244208,Consumer Discretionary,RETAIL: Building Materials
LPG,Dorian LPG Ltd. Common Stock,$36.35,0.44,1.225%,1549216935.00,United States,2014,736147,Consumer Discretionary,Marine Transportation
LPL,LG Display Co Ltd AMERICAN DEPOSITORY SHARES,$4.02,0.01,0.249%,4020000000.00,South Korea,2004,131781,Technology,Industrial Machinery/Components
LPX,Louisiana-Pacific Corporation Common Stock,$107.96,-0.44,-0.406%,7586990806.00,United States,,394651,Basic Materials,Forest Products
LRN,Stride Inc. Common Stock,$84.01,0.16,0.191%,3635817040.00,United States,,628372,Real Estate,Other Consumer Services
LSPD,Lightspeed Commerce Inc. Subordinate Voting Shares,$16.32,-0.12,-0.73%,2500847734.00,Canada,,797137,Technology,Computer Software: Prepackaged Software
LTC,LTC Properties Inc. Common Stock,$36.18,-0.39,-1.066%,1573514655.00,United States,,197542,Real Estate,Real Estate Investment Trusts
LTH,Life Time Group Holdings Inc. Common Stock,$24.02,0.04,0.167%,4789338841.00,United States,2021,925393,Consumer Discretionary,Hotels/Resorts
LTM,LATAM Airlines Group S.A. American Depositary Shares (each representing two thousand (2000) shares of Common Stock),$25.37,-0.61,-2.348%,7667344106.00,,2024,116567,Consumer Discretionary,Air Freight/Delivery Services
LU,Lufax Holding Ltd American Depositary Shares each representing two (2) Ordinary Shares,$4.15,0.48,13.079%,3596556000.00,China,,10940648,Finance,Finance: Consumer Services
LUMN,Lumen Technologies Inc. Common Stock,$6.73,0.02,0.298%,6843131663.00,United States,,11634995,Telecommunications,Telecommunications Equipment
LUV,Southwest Airlines Company Common Stock,$29.57,-0.31,-1.037%,17717073052.00,United States,,7066750,Consumer Discretionary,Air Freight/Delivery Services
LVS,Las Vegas Sands Corp. Common Stock,$51.82,-0.01,-0.019%,38161892145.00,United States,2004,10484129,Consumer Discretionary,Hotels/Resorts
LVWR,LiveWire Group Inc. Common Stock,$6.00,0.06,1.01%,1219501488.00,United States,2022,55001,Consumer Discretionary,Motor Vehicles
LW,Lamb Weston Holdings Inc. Common Stock ,$66.58,1.67,2.573%,9565590745.00,United States,2016,6786762,Consumer Staples,Packaged Foods
LXP,LXP Industrial Trust Common Stock (Maryland REIT),$9.81,-0.08,-0.809%,2887478441.00,United States,,1179253,Real Estate,Real Estate Investment Trusts
LXP^C,LXP Industrial Trust 6.5% Series C Cumulative Convertible Preferred Stock,$53.02,0.91,1.746%,,United States,,595,,
LXU,LSB Industries Inc. Common Stock,$8.28,0.16,1.97%,593022965.00,United States,2003,290217,Industrials,Major Chemicals
LYB,LyondellBasell Industries NV Ordinary Shares Class A (Netherlands),$95.28,-0.53,-0.553%,30974500310.00,Netherlands,,1769252,Industrials,Major Chemicals
LYG,Lloyds Banking Group Plc American Depositary Shares,$3.02,-0.04,-1.307%,185677159441.00,United Kingdom,,10100015,Finance,Commercial Banks
LYV,Live Nation Entertainment Inc. Common Stock,$111.53,0.92,0.832%,25887645534.00,United States,,3375929,Consumer Discretionary,Services-Misc. Amusement & Recreation
LZB,La-Z-Boy Incorporated Common Stock,$41.59,-0.61,-1.445%,1739594995.00,United States,,236569,Consumer Discretionary,Home Furnishings
LZM,Lifezone Metals Limited Ordinary Shares,$6.71,0.02,0.299%,525191378.00,Isle of Man,,55677,Basic Materials,Metal Mining
M,Macy's Inc Common Stock,$15.35,-0.07,-0.454%,4257681936.00,United States,,4594191,Consumer Discretionary,Department/Specialty Retail Stores
MA,Mastercard Incorporated Common Stock,$495.57,-0.81,-0.163%,457824905003.00,United States,2006,1736485,Consumer Discretionary,Business Services
MAA,Mid-America Apartment Communities Inc. Common Stock,$156.96,-0.85,-0.539%,18344888195.00,United States,1994,579470,Real Estate,Real Estate Investment Trusts
MAA^I,Mid-America Apartment Communities Inc. 8.50% Series I Cumulative Redeemable Preferred Stock,$57.95,0.45,0.783%,,United States,,368,,
MAC,Macerich Company (The) Common Stock,$17.68,-0.24,-1.339%,3818726927.00,United States,1994,926486,Real Estate,Real Estate Investment Trusts
MAIN,Main Street Capital Corporation Common Stock,$50.19,0.12,0.24%,4370237987.00,United States,2007,261643,Finance,Finance/Investors Services
MAN,ManpowerGroup Common Stock,$71.40,-1.22,-1.68%,3387779060.00,United States,,527117,Consumer Discretionary,Professional Services
MANU,Manchester United Ltd. Class A Ordinary Shares,$16.28,0.29,1.814%,2756493263.00,United Kingdom,2012,364646,Consumer Discretionary,Services-Misc. Amusement & Recreation
MAS,Masco Corporation Common Stock,$83.26,-0.56,-0.668%,18171398335.00,United States,,1012691,Industrials,Industrial Specialties
MATV,Mativ Holdings Inc. Common Stock,$16.46,-0.17,-1.022%,894222173.00,United States,,274764,Basic Materials,Paper
MATX,Matson Inc. Common Stock,$140.01,-1.09,-0.773%,4701435973.00,United States,,173941,Consumer Discretionary,Marine Transportation
MAV,Pioneer Municipal High Income Advantage Fund Inc.,$8.84,-0.02,-0.226%,0.00,United States,,27829,Finance,Finance Companies
MAX,MediaAlpha Inc. Class A Common Stock,$17.99,0.26,1.466%,1192797842.00,United States,2020,350952,Consumer Discretionary,Business Services
MBC,MasterBrand Inc. Common Stock,$18.08,-0.26,-1.418%,2297412130.00,United States,2022,587673,Consumer Discretionary,Home Furnishings
MBI,MBIA Inc. Common Stock,$3.52,0.06,1.734%,179619102.00,United States,1987,242130,Finance,Property-Casualty Insurers
MC,Moelis & Company Class A Common Stock,$66.44,-1.49,-2.193%,4969382192.00,United States,2014,905782,Finance,Investment Managers
MCB,Metropolitan Bank Holding Corp. Common Stock,$52.00,1.84,3.668%,582032672.00,United States,2017,135663,Finance,Major Banks
MCD,McDonald's Corporation Common Stock,$303.76,0.78,0.257%,217900184709.00,United States,,2350630,Consumer Discretionary,Restaurants
MCI,Barings Corporate Investors Common Stock,$19.94,0.06,0.302%,404018677.00,United States,,19938,Finance,Trusts Except Educational Religious and Charitable
MCK,McKesson Corporation Common Stock,$488.78,-9.70,-1.946%,63383407730.00,United States,,1047995,Health Care,Other Pharmaceuticals
MCN,Madison Covered Call & Equity Strategy Fund Common Stock,$7.05,0.00,0.00%,0.00,United States,2004,55825,,
MCO,Moody's Corporation Common Stock,$470.19,-1.21,-0.257%,85621599000.00,United States,,717561,Finance,Finance: Consumer Services
MCR,MFS Charter Income Trust Common Stock,$6.57,0.005,0.076%,289135057.00,United States,1989,69523,Finance,Trusts Except Educational Religious and Charitable
MCS,Marcus Corporation (The) Common Stock,$16.09,0.94,6.205%,517673304.00,United States,,751504,Consumer Discretionary,Movies/Entertainment
MCW,Mister Car Wash Inc. Common Stock,$6.38,-0.04,-0.623%,2053268331.00,United States,2021,682930,Consumer Discretionary,Automotive Aftermarket
MCY,Mercury General Corporation Common Stock,$63.72,0.34,0.536%,3528248212.00,United States,,197024,Finance,Property-Casualty Insurers
MD,Pediatrix Medical Group Inc. Common Stock,$12.08,0.08,0.667%,1037259359.00,United States,,540863,Health Care,Hospital/Nursing Management
MDT,Medtronic plc. Ordinary Shares,$89.12,-0.88,-0.978%,114295552736.00,United States,,4438894,Health Care,Biotechnology: Electromedical & Electrotherapeutic Apparatus
MDU,MDU Resources Group Inc. Common Stock (Holding Company),$27.20,0.10,0.369%,5545760046.00,United States,,886403,Industrials,Mining & Quarrying of Nonmetallic Minerals (No Fuels)
MDV,Modiv Industrial Inc. Class C Common Stock,$16.10,-0.05,-0.31%,152859856.00,,2022,41945,Real Estate,Real Estate Investment Trusts
MDV^A,Modiv Industrial Inc. 7.375% Series A Cumulative Redeemable Perpetual Preferred Stock,$24.66,-0.05,-0.202%,,,,3636,,
MEC,Mayville Engineering Company Inc. Common Stock,$20.44,-0.59,-2.806%,421463193.00,United States,2019,141368,Industrials,Industrial Specialties
MED,MEDIFAST INC Common Stock,$18.35,-0.87,-4.527%,200701620.00,United States,,154428,Consumer Staples,Packaged Foods
MEG,Montrose Environmental Group Inc. Common Stock,$21.72,-1.27,-5.524%,743474275.00,United States,2020,1496640,Consumer Discretionary,Professional Services
MEGI,NYLI CBRE Global Infrastructure Megatrends Term Fund Common Shares,$14.95,0.07,0.47%,0.00,United States,2021,167090,Finance,Investment Managers
MEI,Methode Electronics Inc. Common Stock,$11.40,-0.01,-0.088%,401793684.00,United States,,245312,Technology,Electrical Products
MER^K,Bank of America Corporation Income Capital Obligation Notes initially due December 15 2066,$25.84,0.16,0.623%,,United States,,31646,,
MET,MetLife Inc. Common Stock,$81.79,0.01,0.012%,57279569073.00,United States,2000,1879127,Finance,Life Insurance
MET^A,MetLife Inc. Preferred Series A Floating Rate,$24.34,-0.05,-0.205%,,United States,,46813,,
MET^E,MetLife Inc. Depositary shares each representing a 1/1000th interest in a share of the Issuera??s 5.625% Non-Cumulative Preferred Stock Series E.,$24.95,0.20,0.808%,,United States,,107986,,
MET^F,MetLife Inc. Depositary Shares each representing a 1/1000th interest in a share of 4.75% Non-Cumulative Preferred Stock Series F,$22.91,0.05,0.219%,,United States,,64074,,
MFA,MFA Financial Inc.,$12.21,-0.17,-1.373%,1246428070.00,United States,,744832,Real Estate,Real Estate Investment Trusts
MFA^B,MFA Financial Inc. Preferred Series B,$22.90,-0.08,-0.348%,,United States,,10289,,
MFA^C,MFA Financial Inc. 6.50% Series C Fixed-to-Floating Rate Cumulative Redeemable Preferred Stock,$23.90,-0.04,-0.167%,,United States,,7815,,
MFAN,MFA Financial Inc. 8.875% Senior Notes due 2029,$25.66,-0.01,-0.039%,2619438515.00,United States,2024,9984,Real Estate,Real Estate Investment Trusts
MFAO,MFA Financial Inc. 9.000% Senior Notes due 2029,$25.82,0.07,0.272%,2635771725.00,United States,2024,5449,Real Estate,Real Estate Investment Trusts
MFC,Manulife Financial Corporation Common Stock,$29.68,0.16,0.542%,52778245770.00,Canada,,1523142,Finance,Life Insurance
MFG,Mizuho Financial Group Inc. Sponosred ADR (Japan),$4.11,-0.09,-2.143%,52167510586.00,Japan,,1197838,Finance,Major Banks
MFM,MFS Municipal Income Trust Common Stock,$5.75,0.01,0.174%,236828878.00,United States,1986,88867,Finance,Finance Companies
MG,Mistras Group Inc Common Stock,$11.30,-0.03,-0.265%,350044846.00,United States,2009,82007,Consumer Discretionary,Military/Government/Technical
MGA,Magna International Inc. Common Stock,$41.29,0.32,0.781%,11861795123.00,Canada,,908447,Consumer Discretionary,Auto Parts:O.E.M.
MGF,MFS Government Markets Income Trust Common Stock,$3.285,-0.015,-0.455%,107082436.00,United States,1987,60792,Finance,Trusts Except Educational Religious and Charitable
MGM,MGM Resorts International Common Stock,$39.62,1.00,2.589%,12035356386.00,United States,,4406441,Consumer Discretionary,Hotels/Resorts
MGR,Affiliated Managers Group Inc. 5.875% Junior Subordinated Notes due 2059,$25.00,0.03,0.12%,745349175.00,United States,2019,20735,Finance,Investment Managers
MGRB,Affiliated Managers Group Inc. 4.750% Junior Subordinated Notes due 2060,$20.49,0.18,0.886%,610888184.00,United States,2020,11173,Finance,Investment Managers
MGRD,Affiliated Managers Group Inc. 4.200% Junior Subordinated Notes due 2061,$17.95,0.06,0.335%,535160708.00,United States,2021,10223,Finance,Investment Managers
MGRE,Affiliated Managers Group Inc. 6.750% Junior Subordinated Notes due 2064,$25.92,-0.09,-0.346%,0.00,United States,2024,42737,,
MGY,Magnolia Oil & Gas Corporation Class A Common Stock,$25.20,0.35,1.408%,5017815281.00,United States,2017,1659786,Energy,Oil & Gas Production
MHD,Blackrock MuniHoldings Fund Inc. Common Stock,$12.83,0.02,0.156%,1908622503.00,United States,1997,103521,Finance,Investment Bankers/Brokers/Service
MHF,Western Asset Municipal High Income Fund Inc. Common Stock,$7.29,-0.01,-0.137%,0.00,United States,1988,98560,Finance,Finance/Investors Services
MHI,Pioneer Municipal High Income Fund Inc.,$9.60,-0.03,-0.312%,0.00,United States,2003,44911,Finance,Investment Managers
MHK,Mohawk Industries Inc. Common Stock,$159.49,0.00,0.00%,10066542451.00,United States,,535796,Consumer Discretionary,Home Furnishings
MHLA,Maiden Holdings Ltd. 6.625% Notes due 2046,$16.3601,0.00,0.00%,1632318376.00,Bermuda,2016,37,Finance,Property-Casualty Insurers
MHN,Blackrock MuniHoldings New York Quality Fund Inc. Common Stock,$11.18,0.01,0.09%,1663164426.00,United States,1997,64618,Finance,Investment Bankers/Brokers/Service
MHNC,Maiden Holdings North America Ltd. 7.75% Notes due 2043,$17.49,0.00,0.00%,1745053416.00,Bermuda,2013,472,Finance,Property-Casualty Insurers
MHO,M/I Homes Inc. Common Stock,$167.05,-5.29,-3.07%,4579134174.00,United States,1993,171334,Consumer Discretionary,Homebuilding
MIN,MFS Intermediate Income Trust Common Stock,$2.74,-0.02,-0.725%,314819893.00,United States,1988,210140,Finance,Trusts Except Educational Religious and Charitable
MIO,Pioneer Municipal High Income Opportunities Fund Inc. Common Stock,$12.38,-0.04,-0.322%,0.00,,2021,45874,Finance,Investment Managers
MIR,Mirion Technologies Inc. Class A Common Stock,$11.10,0.16,1.463%,2577723452.00,United States,2020,1853576,Industrials,Industrial Machinery/Components
MITN,AG Mortgage Investment Trust Inc. 9.500% Senior Notes due 2029,$25.48,-0.02,-0.078%,751481232.00,United States,2024,11597,Real Estate,Real Estate Investment Trusts
MITP,AG Mortgage Investment Trust Inc. 9.500% Senior Notes due 2029,$25.57,0.00,0.00%,754135601.00,United States,2024,532,Real Estate,Real Estate Investment Trusts
MITT,AG Mortgage Investment Trust Inc. Common Stock,$7.31,-0.06,-0.814%,215593713.00,United States,2011,70069,Real Estate,Real Estate Investment Trusts
MITT^A,AG Mortgage Investment Trust Inc. 8.25% Preferred Series A,$23.0479,0.4479,1.982%,,United States,,1820,,
MITT^B,AG Mortgage Investment Trust Inc. Preferred Series B,$22.30,0.0201,0.09%,,United States,,11722,,
