Symbol,Name,Last Sale,Net Change,% Change,Market Cap,Country,IPO Year,Volume,Sector,Industry
KIM^L,Kimco Realty Corporation Class L Depositary Shares each of which represents a one-one thousandth fractional interest in a share of 5.125% Class L Cumulative Redeemable Preferred Stock liquidation preference $25000.00 per share,$22.597,-0.023,-0.102%,,United States,,922,,
KIM^M,Kimco Realty Corporation Class M Depositary Shares each of which represents a one-one thousandth fractional interest in a share of 5.25% Class M Cumulative Redeemable Preferred Stock liquidation preference $25000.00 per share,$23.20,0.08,0.346%,,United States,,1239,,
KIM^N,Kimco Realty Corporation Depositary Shares each representing 1/1000th interest in a share of 7.25% Class N Cumulative Convertible Perpetual Preferred Stock,$62.30,-0.01,-0.016%,,United States,,1235,,
KIND,Nextdoor Holdings Inc. Class A Common Stock,$2.455,-0.035,-1.406%,938161340.00,United States,,122359,Technology,Computer Software: Programming Data Processing
KIO,KKR Income Opportunities Fund Common Shares,$13.30,0.00,0.00%,0.00,United States,2013,23722,Finance,Investment Managers
KKR,KKR & Co. Inc. Common Stock,$152.22,0.09,0.059%,135206204528.00,United States,,370628,Finance,Investment Managers
KKRS,KKR Group Finance Co. IX LLC 4.625% Subordinated Notes due 2061,$19.70,0.01,0.051%,17498109507.00,United States,2021,420,,
KLC,KinderCare Learning Companies Inc. Common Stock,$25.775,0.145,0.566%,2947785944.00,,2024,49701,Consumer Discretionary,Other Consumer Services
KLG,WK Kellogg Co Common Stock,$17.70,0.25,1.433%,1524416819.00,United States,2023,168212,Consumer Staples,Packaged Foods
KMB,Kimberly-Clark Corporation Common Stock,$132.145,-0.045,-0.034%,44068415629.00,United States,,274503,Consumer Discretionary,Containers/Packaging
KMI,Kinder Morgan Inc. Common Stock,$26.90,0.10,0.373%,59762119901.00,United States,2011,1459253,Utilities,Natural Gas Distribution
KMPB,Kemper Corporation 5.875% Fixed-Rate Reset Junior Subordinated Debentures due 2062,$23.60,-0.07,-0.296%,1511473210.00,United States,2022,1534,Finance,Property-Casualty Insurers
KMPR,Kemper Corporation,$70.11,0.38,0.545%,4490228252.00,United States,,32149,Finance,Property-Casualty Insurers
KMT,Kennametal Inc. Common Stock,$29.37,0.01,0.034%,2282809154.00,United States,,59053,Industrials,Industrial Machinery/Components
KMX,CarMax Inc,$79.39,1.53,1.965%,12299443432.00,United States,,308974,Consumer Discretionary,Retail-Auto Dealers and Gas Stations
KN,Knowles Corporation Common Stock,$18.38,-0.07,-0.379%,1618706070.00,United States,2014,29614,Consumer Staples,Consumer Electronics/Appliances
KNF,Knife Riv Holding Co. Common Stock,$95.855,0.475,0.498%,5426610838.00,United States,2023,35450,Industrials,Mining & Quarrying of Nonmetallic Minerals (No Fuels)
KNOP,KNOT Offshore Partners LP Common Units representing Limited Partner Interests,$6.21,0.01,0.161%,211419953.00,United Kingdom,2013,9477,Consumer Discretionary,Marine Transportation
KNSL,Kinsale Capital Group Inc. Common Stock,$480.4375,2.9375,0.615%,11188417930.00,United States,,13585,Finance,Property-Casualty Insurers
KNTK,Kinetik Holdings Inc. Class A Common Stock,$56.6881,0.9781,1.756%,8930490613.00,United States,2022,98412,Utilities,Natural Gas Distribution
KNX,Knight-Swift Transportation Holdings Inc.,$56.74,-0.36,-0.63%,9185808820.00,United States,2017,143282,Industrials,Trucking Freight/Courier Services
KO,Coca-Cola Company (The) Common Stock,$62.56,-0.44,-0.698%,269495788953.00,United States,,3151823,Consumer Staples,Beverages (Production/Distribution)
KODK,Eastman Kodak Company Common New,$4.505,-0.085,-1.852%,361751500.00,United States,,226560,Consumer Discretionary,Industrial Machinery/Components
KOF,Coca Cola Femsa S.A.B. de C.V.  American Depositary Shares each representing 10 Units (each Unit consists of 3 Series B Shares and 5 Series L Shares),$78.10,-0.12,-0.153%,16407499951.00,Mexico,1993,35500,Consumer Staples,Beverages (Production/Distribution)
KOP,Koppers Holdings Inc. Common Stock,$37.72,-0.20,-0.527%,764543926.00,United States,2006,19097,Basic Materials,Forest Products
KORE,KORE Group Holdings Inc. Common Stock,$1.75,0.02,1.156%,31662372.00,United States,,5504,Telecommunications,Telecommunications Equipment
KOS,Kosmos Energy Ltd. Common Shares (DE),$3.965,0.075,1.928%,1871065578.00,Bermuda,2011,1743919,Energy,Oil & Gas Production
KR,Kroger Company (The) Common Stock,$59.61,0.03,0.05%,43127017032.00,United States,,272024,Consumer Staples,Food Chains
KRC,Kilroy Realty Corporation Common Stock,$39.50,-0.43,-1.077%,4662843623.00,United States,1997,131859,Real Estate,Real Estate Investment Trusts
KREF,KKR Real Estate Finance Trust Inc. Common Stock,$11.555,0.025,0.217%,803911982.00,United States,2017,41198,Real Estate,Real Estate Investment Trusts
KREF^A,KKR Real Estate Finance Trust Inc. 6.50% Series A Cumulative Redeemable Preferred Stock,$20.94,-0.11,-0.523%,,United States,,899,,
KRG,Kite Realty Group Trust Common Stock,$27.09,-0.18,-0.66%,5950755435.00,United States,2004,41811,Real Estate,Real Estate Investment Trusts
KRO,Kronos Worldwide Inc Common Stock,$11.285,-0.115,-1.009%,1298184826.00,United States,,6774,Industrials,Major Chemicals
KRP,Kimbell Royalty Partners Common Units Representing Limited Partner Interests,$16.39,0.06,0.367%,1565142907.00,United States,2017,68239,Energy,Oil & Gas Production
KSS,Kohl's Corporation Common Stock,$18.455,0.365,2.018%,2052905687.00,United States,1992,888250,Consumer Discretionary,Department/Specialty Retail Stores
KT,KT Corporation Common Stock,$15.08,-0.25,-1.631%,7431828808.00,South Korea,,273685,Telecommunications,Telecommunications Equipment
KTB,Kontoor Brands Inc. Common Stock ,$90.585,0.285,0.316%,4994990241.00,United States,2019,21153,Consumer Discretionary,Apparel
KTF,DWS Municipal Income Trust,$9.907,0.057,0.579%,391335793.00,United States,1988,14656,Finance,Finance Companies
KTH,Structures Products Cp 8% CorTS Issued by Peco Energy Cap Tr II Preferred Stock,$29.89,1.50,5.284%,0.00,United States,,1670,Finance,Finance: Consumer Services
KTN,Structured Products Corp 8.205% CorTS 8.205% Corporate Backed Trust Securities (CorTS),$27.4032,0.1432,0.525%,0.00,United States,,3921,Finance,Finance: Consumer Services
KUKE,Kuke Music Holding Limited American Depositary Shares each representing one Ordinary Share,$0.4098,-0.0002,-0.049%,13626556.00,,2021,5289,Real Estate,Other Consumer Services
KVUE,Kenvue Inc. Common Stock,$23.50,0.36,1.556%,45055549793.00,United States,2023,1670931,Consumer Discretionary,Specialty Chemicals
KVYO,Klaviyo Inc. Series A Common Stock,$36.925,0.255,0.695%,9956220643.00,United States,2023,218870,Technology,Computer Software: Prepackaged Software
KW,Kennedy-Wilson Holdings Inc. Common Stock,$10.97,0.05,0.458%,1507408795.00,United States,,36784,Finance,Real Estate
KWR,Quaker Houghton Common Stock,$169.705,-1.925,-1.122%,3018680805.00,United States,,6944,Industrials,Major Chemicals
KYN,Kayne Anderson Energy Infrastructure Fund Inc.,$12.77,-0.05,-0.39%,1738399638.00,United States,2004,69489,Finance,Finance/Investors Services
L,Loews Corporation Common Stock,$83.155,-0.055,-0.066%,18109224648.00,United States,,68395,Finance,Property-Casualty Insurers
LAAC,Lithium Americas (Argentina) Corp. Common Shares,$3.19,-0.03,-0.932%,514547000.00,Canada,2023,277985,,
LAC,Lithium Americas Corp. Common Shares,$4.06,-0.16,-3.791%,654878000.00,Canada,2023,3525965,Basic Materials,Metal Mining
LAD,Lithia Motors Inc. Common Stock,$378.41,2.30,0.612%,10079766202.00,United States,,26552,Consumer Discretionary,Retail-Auto Dealers and Gas Stations
LADR,Ladder Capital Corp Class A Common Stock,$11.745,0.085,0.729%,1499108087.00,United States,2014,86066,Real Estate,Real Estate Investment Trusts
LANV,Lanvin Group Holdings Limited Ordinary Shares,$1.54,0.01,0.654%,201695448.00,Cayman Islands,2022,450,Finance,Blank Checks
LAW,CS Disco Inc. Common Stock,$5.67,-0.16,-2.744%,339682703.00,United States,2021,6633,Technology,Computer Software: Prepackaged Software
LAZ,Lazard Inc. Common Stock,$55.77,0.82,1.492%,6288964895.00,Bermuda,2005,49911,Finance,Investment Managers
LB,LandBridge Company LLC Class A Shares Representing Limited Liability Company Interests,$68.11,-2.50,-3.541%,4982355680.00,,2024,75857,Energy,Oil & Gas Production
LBRT,Liberty Energy Inc. Class A common stock,$17.42,-0.13,-0.741%,2846701233.00,United States,2018,265451,Energy,Oilfield Services/Equipment
LC,LendingClub Corporation Common Stock,$15.40,-0.15,-0.965%,1730990646.00,United States,2014,233682,Finance,Finance: Consumer Services
LCII,LCI Industries,$116.805,1.895,1.649%,2974131077.00,United States,1995,11974,Consumer Discretionary,Auto Parts:O.E.M.
LDI,loanDepot Inc. Class A Common Stock,$2.535,-0.055,-2.124%,828946617.00,United States,2021,76890,Finance,Finance: Consumer Services
LDOS,Leidos Holdings Inc. Common Stock,$186.55,-7.85,-4.038%,24891946484.00,United States,,320559,Technology,EDP Services
LDP,Cohen & Steers Limited Duration Preferred and Income Fund Inc.,$21.1124,0.0024,0.011%,0.00,United States,2012,10817,Finance,Finance Companies
LEA,Lear Corporation Common Stock,$98.62,0.04,0.041%,5359136639.00,United States,,78557,Consumer Discretionary,Auto Parts:O.E.M.
LEG,Leggett & Platt Incorporated Common Stock,$12.14,-0.03,-0.247%,1630339066.00,United States,,222015,Consumer Discretionary,Home Furnishings
LEN,Lennar Corporation Class A Common Stock,$171.17,4.84,2.91%,46428980461.00,United States,,515507,Consumer Discretionary,Homebuilding
LEO,BNY Mellon Strategic Municipals Inc. Common Stock,$6.275,0.015,0.24%,390875109.00,United States,1987,21569,Finance,Trusts Except Educational Religious and Charitable
LEV,The Lion Electric Company Common Shares,$0.3578,-0.0058,-1.595%,80940636.00,Canada,2021,102322,Consumer Discretionary,Auto Manufacturing
LEVI,Levi Strauss & Co Class A Common Stock,$16.845,-0.135,-0.795%,6682874855.00,United States,2019,126129,Consumer Discretionary,Apparel
LFT,Lument Finance Trust Inc. Common Stock,$2.395,0.015,0.63%,125199176.00,United States,2013,20549,Real Estate,Real Estate Investment Trusts
LFT^A,Lument Finance Trust Inc. 7.875% Series A Cumulative Redeemable Preferred Stock,$23.12,0.3023,1.325%,,United States,,2224,,
LGI,Lazard Global Total Return and Income Fund Common Stock,$16.70,-0.09,-0.536%,0.00,United States,2004,8966,,
LH,Labcorp Holdings Inc. Common Stock,$241.75,-4.47,-1.815%,20219791347.00,United States,,79804,Health Care,Medical Specialities
LHX,L3Harris Technologies Inc. Common Stock,$256.365,-5.285,-2.02%,48624330137.00,United States,,76854,Industrials,Industrial Machinery/Components
LICY,Li-Cycle Holdings Corp. Common Shares,$2.395,-0.185,-7.171%,55611752.00,Canada,2021,482767,Industrials,Environmental Services
LII,Lennox International Inc. Common Stock,$614.655,-4.685,-0.756%,21896027168.00,United States,1999,16715,Industrials,Industrial Machinery/Components
LITB,LightInTheBox Holding Co. Ltd. American Depositary Shares each representing twelve ordinary shares,$2.02,-0.0599,-2.88%,37136819.00,China,,3194,Consumer Discretionary,Catalog/Specialty Distribution
LLY,Eli Lilly and Company Common Stock,$797.35,-14.46,-1.781%,756936868611.00,United States,,867639,Health Care,Biotechnology: Pharmaceutical Preparations
LMND,Lemonade Inc. Common Stock,$32.47,0.48,1.50%,2318505414.00,United States,2020,567214,Finance,Property-Casualty Insurers
LMT,Lockheed Martin Corporation Common Stock,$547.18,-10.55,-1.892%,129700960680.00,United States,,258564,Industrials,Military/Government/Technical
LNC,Lincoln National Corporation Common Stock,$35.28,0.25,0.714%,6009707602.00,United States,,98402,Finance,Life Insurance
LNC^D,Lincoln National Corporation Depositary Shares Each Representing a 1/1000th Interest in a Share of 9.000% Non-Cumulative Preferred Stock Series D,$28.38,-0.07,-0.246%,,United States,,4576,,
LND,Brasilagro Brazilian Agric Real Estate Co Sponsored ADR (Brazil),$4.16,0.08,1.961%,427163127.00,Brazil,,5382,Consumer Staples,Farming/Seeds/Milling
LNG,Cheniere Energy Inc. Common Stock,$210.185,0.185,0.088%,47158171397.00,United States,2001,206670,Utilities,Oil/Gas Transmission
LNN,Lindsay Corporation Common Stock,$124.815,0.665,0.536%,1353803651.00,United States,,8980,Industrials,Industrial Machinery/Components
LOAR,Loar Holdings Inc. Common Stock,$79.6436,-1.2964,-1.602%,7144315327.00,United States,2024,94669,Industrials,Military/Government/Technical
LOB,Live Oak Bancshares Inc. Common Stock,$48.615,0.145,0.299%,2196882924.00,United States,2022,14176,Finance,Major Banks
LOCL,Local Bounti Corporation Common Stock,$2.22,-0.1175,-5.027%,19189305.00,,2021,686,Consumer Staples,Farming/Seeds/Milling
LOMA,Loma Negra Compania Industrial Argentina Sociedad Anonima ADS,$10.40,-0.01,-0.096%,1213644952.00,Argentina,2017,293351,Industrials,Building Materials
LOW,Lowe's Companies Inc. Common Stock,$273.2475,0.9275,0.341%,155011713444.00,United States,,356295,Consumer Discretionary,RETAIL: Building Materials
LPG,Dorian LPG Ltd. Common Stock,$28.034,0.674,2.463%,1199980764.00,United States,2014,99826,Consumer Discretionary,Marine Transportation
LPL,LG Display Co Ltd AMERICAN DEPOSITORY SHARES,$3.395,0.055,1.647%,3395000000.00,South Korea,2004,20727,Technology,Industrial Machinery/Components
LPX,Louisiana-Pacific Corporation Common Stock,$112.22,0.77,0.691%,7882135405.00,United States,,29590,Basic Materials,Forest Products
LRN,Stride Inc. Common Stock,$100.3533,-0.0967,-0.096%,4374655244.00,United States,,31926,Real Estate,Other Consumer Services
LSPD,Lightspeed Commerce Inc. Subordinate Voting Shares,$18.424,0.074,0.403%,2823260947.00,Canada,,109369,Technology,Computer Software: Prepackaged Software
LTC,LTC Properties Inc. Common Stock,$37.99,-0.61,-1.58%,1719456044.00,United States,,34686,Real Estate,Real Estate Investment Trusts
LTH,Life Time Group Holdings Inc. Common Stock,$23.99,-0.19,-0.786%,4965273370.00,United States,2021,113968,Consumer Discretionary,Hotels/Resorts
LTM,LATAM Airlines Group S.A. American Depositary Shares (each representing two thousand (2000) shares of Common Stock),$28.13,0.39,1.406%,8501473776.00,,2024,85142,Consumer Discretionary,Air Freight/Delivery Services
LU,Lufax Holding Ltd American Depositary Shares each representing two (2) Ordinary Shares,$2.31,-0.10,-4.149%,2001938400.00,China,,1011625,Finance,Finance: Consumer Services
LUMN,Lumen Technologies Inc. Common Stock,$8.57,-0.32,-3.60%,8696940948.00,United States,,2720237,Telecommunications,Telecommunications Equipment
LUV,Southwest Airlines Company Common Stock,$32.83,0.45,1.39%,19689372900.00,United States,,1029119,Consumer Discretionary,Air Freight/Delivery Services
LVS,Las Vegas Sands Corp. Common Stock,$48.54,-0.99,-1.999%,35192770680.00,United States,2004,2018963,Consumer Discretionary,Hotels/Resorts
LVWR,LiveWire Group Inc. Common Stock,$6.505,0.085,1.324%,1322142863.00,United States,2022,1257,Consumer Discretionary,Motor Vehicles
LW,Lamb Weston Holdings Inc. Common Stock ,$80.075,0.005,0.006%,11418516913.00,United States,2016,200157,Consumer Staples,Packaged Foods
LXP,LXP Industrial Trust Common Stock (Maryland REIT),$9.44,-0.09,-0.944%,2780169387.00,United States,,105494,Real Estate,Real Estate Investment Trusts
LXP^C,LXP Industrial Trust 6.5% Series C Cumulative Convertible Preferred Stock,$51.08,-0.45,-0.873%,,United States,,1497,,
LXU,LSB Industries Inc. Common Stock,$8.60,-0.13,-1.489%,615941727.00,United States,2003,25800,Industrials,Major Chemicals
LYB,LyondellBasell Industries NV Ordinary Shares Class A (Netherlands),$82.88,-0.56,-0.671%,26915845159.00,Netherlands,,197633,Industrials,Major Chemicals
LYG,Lloyds Banking Group Plc American Depositary Shares,$2.775,0.025,0.909%,170613946175.00,United Kingdom,,4016001,Finance,Commercial Banks
LYV,Live Nation Entertainment Inc. Common Stock,$127.07,0.05,0.039%,29525182753.00,United States,,227059,Consumer Discretionary,Services-Misc. Amusement & Recreation
LZB,La-Z-Boy Incorporated Common Stock,$43.71,0.53,1.227%,1828268748.00,United States,,49787,Consumer Discretionary,Home Furnishings
LZM,Lifezone Metals Limited Ordinary Shares,$6.74,-0.20,-2.882%,527539476.00,Isle of Man,,3182,Basic Materials,Metal Mining
M,Macy's Inc Common Stock,$15.47,0.40,2.654%,4290966746.00,United States,,800638,Consumer Discretionary,Department/Specialty Retail Stores
MA,Mastercard Incorporated Common Stock,$521.07,-0.81,-0.155%,478254213760.00,United States,2006,423430,Consumer Discretionary,Business Services
MAA,Mid-America Apartment Communities Inc. Common Stock,$160.24,-1.10,-0.682%,18728897830.00,United States,1994,72883,Real Estate,Real Estate Investment Trusts
MAA^I,Mid-America Apartment Communities Inc. 8.50% Series I Cumulative Redeemable Preferred Stock,$58.41,0.00,0.00%,,United States,,255,,
MAC,Macerich Company (The) Common Stock,$19.12,-0.02,-0.104%,4312085513.00,United States,1994,205701,Real Estate,Real Estate Investment Trusts
MAGN,Magnera Corporation Common Stock,$18.025,-0.375,-2.038%,63085247.00,United States,2000,374156,Basic Materials,Paper
MAIN,Main Street Capital Corporation Common Stock,$52.505,0.275,0.527%,4629795866.00,United States,2007,118181,Finance,Finance/Investors Services
MAN,ManpowerGroup Common Stock,$63.40,-0.39,-0.611%,2975765414.00,United States,,14636,Consumer Discretionary,Professional Services
MANU,Manchester United Ltd. Class A Ordinary Shares,$17.39,0.01,0.058%,2944435986.00,United Kingdom,2012,28895,Consumer Discretionary,Services-Misc. Amusement & Recreation
MAS,Masco Corporation Common Stock,$79.52,0.27,0.341%,17156351971.00,United States,,151390,Industrials,Industrial Specialties
MATV,Mativ Holdings Inc. Common Stock,$12.275,-0.025,-0.203%,666863741.00,United States,,48422,Basic Materials,Paper
MATX,Matson Inc. Common Stock,$167.16,-0.21,-0.125%,5551405665.00,United States,,20186,Consumer Discretionary,Marine Transportation
MAV,Pioneer Municipal High Income Advantage Fund Inc.,$8.72,0.02,0.23%,0.00,United States,,6473,Finance,Finance Companies
MAX,MediaAlpha Inc. Class A Common Stock,$12.691,0.061,0.483%,846035832.00,United States,2020,49337,Consumer Discretionary,Business Services
MBC,MasterBrand Inc. Common Stock,$16.995,0.175,1.04%,2160122929.00,United States,2022,59792,Consumer Discretionary,Home Furnishings
MBI,MBIA Inc. Common Stock,$5.515,0.605,12.322%,281431046.00,United States,1987,690670,Finance,Property-Casualty Insurers
MC,Moelis & Company Class A Common Stock,$75.965,0.605,0.803%,5691167520.00,United States,2014,45664,Finance,Investment Managers
MCB,Metropolitan Bank Holding Corp. Common Stock,$65.48,0.29,0.445%,733220485.00,United States,2017,5579,Finance,Major Banks
MCD,McDonald's Corporation Common Stock,$299.09,1.74,0.585%,214333781886.00,United States,,288546,Consumer Discretionary,Restaurants
MCI,Barings Corporate Investors Common Stock,$19.41,0.25,1.305%,393279966.00,United States,,14333,Finance,Trusts Except Educational Religious and Charitable
MCK,McKesson Corporation Common Stock,$617.105,-7.495,-1.20%,78335368559.00,United States,,112058,Health Care,Other Pharmaceuticals
MCN,Madison Covered Call & Equity Strategy Fund Common Stock,$7.01,0.00,0.00%,0.00,United States,2004,15133,,
MCO,Moody's Corporation Common Stock,$483.41,3.99,0.832%,88028961000.00,United States,,77998,Finance,Finance: Consumer Services
MCR,MFS Charter Income Trust Common Stock,$6.2401,0.0001,0.002%,274616692.00,United States,1989,57252,Finance,Trusts Except Educational Religious and Charitable
MCS,Marcus Corporation (The) Common Stock,$22.22,0.24,1.092%,699530707.00,United States,,47659,Consumer Discretionary,Movies/Entertainment
MCW,Mister Car Wash Inc. Common Stock,$8.105,0.125,1.566%,2611835974.00,United States,2021,326839,Consumer Discretionary,Automotive Aftermarket
MCY,Mercury General Corporation Common Stock,$73.7059,-0.7141,-0.96%,4081178750.00,United States,,25013,Finance,Property-Casualty Insurers
MD,Pediatrix Medical Group Inc. Common Stock,$14.91,-0.31,-2.037%,1280478061.00,United States,,99398,Health Care,Hospital/Nursing Management
MDT,Medtronic plc. Ordinary Shares,$86.89,-1.08,-1.228%,111435598937.00,United States,,917985,Health Care,Biotechnology: Electromedical & Electrotherapeutic Apparatus
MDU,MDU Resources Group Inc. Common Stock (Holding Company),$18.27,0.01,0.055%,3725038090.00,United States,,265941,Industrials,Mining & Quarrying of Nonmetallic Minerals (No Fuels)
MDV,Modiv Industrial Inc. Class C Common Stock,$15.93,-0.03,-0.188%,153665145.00,,2022,1210,Real Estate,Real Estate Investment Trusts
MDV^A,Modiv Industrial Inc. 7.375% Series A Cumulative Redeemable Perpetual Preferred Stock,$24.81,0.00,0.00%,,,,11,,
MEC,Mayville Engineering Company Inc. Common Stock,$17.33,-0.24,-1.366%,357766291.00,United States,2019,20762,Industrials,Industrial Specialties
MED,MEDIFAST INC Common Stock,$19.14,-0.43,-2.197%,209350066.00,United States,,24283,Consumer Staples,Packaged Foods
MEG,Montrose Environmental Group Inc. Common Stock,$21.70,-0.30,-1.364%,744326232.00,United States,2020,53789,Consumer Discretionary,Professional Services
MEGI,NYLI CBRE Global Infrastructure Megatrends Term Fund Common Shares,$13.33,0.11,0.832%,0.00,United States,2021,24083,Finance,Investment Managers
MEI,Methode Electronics Inc. Common Stock,$9.645,-0.005,-0.052%,339938604.00,United States,,19688,Technology,Electrical Products
MER^K,Bank of America Corporation Income Capital Obligation Notes initially due December 15 2066,$26.14,0.00,0.00%,,United States,,2559,,
MET,MetLife Inc. Common Stock,$83.32,1.30,1.585%,57692469644.00,United States,2000,600692,Finance,Life Insurance
MET^A,MetLife Inc. Preferred Series A Floating Rate,$24.52,-0.03,-0.122%,,United States,,3461,,
MET^E,MetLife Inc. Depositary Shares ,$24.44,-0.01,-0.041%,,United States,,15200,,
MET^F,MetLife Inc. Depositary Shares each representing a 1/1000th interest in a share of 4.75% Non-Cumulative Preferred Stock Series F,$21.37,-0.14,-0.651%,,United States,,17728,,
MFA,MFA Financial Inc.,$11.09,0.02,0.181%,1132095601.00,United States,,146905,Real Estate,Real Estate Investment Trusts
MFA^B,MFA Financial Inc. Preferred Series B,$22.34,0.00,0.00%,,United States,,41,,
MFA^C,MFA Financial Inc. 6.50% Series C Fixed-to-Floating Rate Cumulative Redeemable Preferred Stock,$24.44,-0.02,-0.082%,,United States,,702,,
MFAN,MFA Financial Inc. 8.875% Senior Notes due 2029,$25.15,0.032,0.127%,2567376409.00,United States,2024,296,Real Estate,Real Estate Investment Trusts
MFAO,MFA Financial Inc. 9.000% Senior Notes due 2029,$25.30,0.10,0.397%,2582688793.00,United States,2024,2950,Real Estate,Real Estate Investment Trusts
MFC,Manulife Financial Corporation Common Stock,$32.76,0.32,0.986%,58255233538.00,Canada,,289862,Finance,Life Insurance
MFG,Mizuho Financial Group Inc. Sponosred ADR (Japan),$4.745,0.225,4.978%,60227454435.00,Japan,,714250,Finance,Major Banks
MFM,MFS Municipal Income Trust Common Stock,$5.57,-0.01,-0.179%,229415105.00,United States,1986,8839,Finance,Finance Companies
MG,Mistras Group Inc Common Stock,$9.09,0.02,0.221%,281884309.00,United States,2009,15025,Consumer Discretionary,Military/Government/Technical
MGA,Magna International Inc. Common Stock,$44.53,0.34,0.769%,12792582630.00,Canada,,122584,Consumer Discretionary,Auto Parts:O.E.M.
MGF,MFS Government Markets Income Trust Common Stock,$3.07,0.00,0.00%,100073997.00,United States,1987,14889,Finance,Trusts Except Educational Religious and Charitable
MGM,MGM Resorts International Common Stock,$38.195,0.215,0.566%,11372197672.00,United States,,672208,Consumer Discretionary,Hotels/Resorts
MGR,Affiliated Managers Group Inc. 5.875% Junior Subordinated Notes due 2059,$23.84,0.02,0.084%,720567147.00,United States,2019,3610,Finance,Investment Managers
MGRB,Affiliated Managers Group Inc. 4.750% Junior Subordinated Notes due 2060,$19.195,0.035,0.183%,580171409.00,United States,2020,3463,Finance,Investment Managers
MGRD,Affiliated Managers Group Inc. 4.200% Junior Subordinated Notes due 2061,$17.3914,0.2214,1.289%,525657361.00,United States,2021,2018,Finance,Investment Managers
MGRE,Affiliated Managers Group Inc. 6.750% Junior Subordinated Notes due 2064,$25.52,0.00,0.00%,0.00,United States,2024,1098,,
MGY,Magnolia Oil & Gas Corporation Class A Common Stock,$27.205,0.125,0.462%,5347407455.00,United States,2017,124988,Energy,Oil & Gas Production
MHD,Blackrock MuniHoldings Fund Inc. Common Stock,$12.25,0.01,0.082%,1822340270.00,United States,1997,28737,Finance,Investment Bankers/Brokers/Service
MHF,Western Asset Municipal High Income Fund Inc. Common Stock,$7.125,0.02,0.281%,0.00,United States,1988,26232,Finance,Finance/Investors Services
MHI,Pioneer Municipal High Income Fund Inc.,$9.475,0.055,0.584%,0.00,United States,2003,5488,Finance,Investment Managers
MHK,Mohawk Industries Inc. Common Stock,$142.22,0.74,0.523%,8977106166.00,United States,,63733,Consumer Discretionary,Home Furnishings
MHLA,Maiden Holdings Ltd. 6.625% Notes due 2046,$17.11,0.00,0.00%,1699378974.00,Bermuda,2016,6,Finance,Property-Casualty Insurers
MHN,Blackrock MuniHoldings New York Quality Fund Inc. Common Stock,$10.75,0.03,0.28%,1599196563.00,United States,1997,25955,Finance,Investment Bankers/Brokers/Service
MHNC,Maiden Holdings North America Ltd. 7.75% Notes due 2043,$18.30,0.00,0.00%,1817570732.00,Bermuda,2013,3,Finance,Property-Casualty Insurers
MHO,M/I Homes Inc. Common Stock,$155.785,2.175,1.416%,4238139337.00,United States,1993,25545,Consumer Discretionary,Homebuilding
MIN,MFS Intermediate Income Trust Common Stock,$2.675,-0.005,-0.187%,307351537.00,United States,1988,104718,Finance,Trusts Except Educational Religious and Charitable
MIO,Pioneer Municipal High Income Opportunities Fund Inc. Common Stock,$12.26,0.04,0.327%,0.00,,2021,1331,Finance,Investment Managers
