Symbol,Name,Last Sale,Net Change,% Change,Market Cap,Country,IPO Year,Volume,Sector,Industry
DBRG,DigitalBridge Group Inc.,$12.61,0.09,0.719%,2196513429.00,United States,2014,278780,Real Estate,Real Estate Investment Trusts
DBRG^H,DigitalBridge Group Inc. 7.125% Series H ,$24.87,0.00,0.00%,,United States,,83,,
DBRG^I,DigitalBridge Group Inc. 7.15% Series I ,$24.72,0.00,0.00%,,United States,,39,,
DBRG^J,DigitalBridge Group Inc. 7.125% Series J ,$24.70,-0.03,-0.121%,,United States,,543,,
DCF,BNY Mellon Alcentra Global Credit Income 2024 Target Term Fund Inc. Common Stock,$9.21,-0.03,-0.325%,0.00,,2017,794,Finance,Finance/Investors Services
DCI,Donaldson Company Inc. Common Stock,$77.16,-0.24,-0.31%,9238528913.00,United States,,53262,Industrials,Pollution Control Equipment
DCO,Ducommun Incorporated Common Stock,$67.84,-0.06,-0.088%,1002627712.00,United States,,17094,Industrials,Military/Government/Technical
DD,DuPont de Nemours Inc. Common Stock,$83.72,0.32,0.384%,34991227009.00,United States,2017,198709,Industrials,Major Chemicals
DDD,3D Systems Corporation Common Stock,$2.765,-0.665,-19.388%,369331491.00,United States,,2365590,Technology,Computer Software: Prepackaged Software
DDL,Dingdong (Cayman) Limited American Depositary Shares (each two representing three Ordinary Shares),$4.21,-0.04,-0.941%,761336400.00,Cayman Islands,2021,530026,Consumer Discretionary,Catalog/Specialty Distribution
DDS,Dillard's Inc. Common Stock,$429.57,41.06,10.569%,6949971362.00,United States,,45613,Consumer Discretionary,Department/Specialty Retail Stores
DDT,Dillard's Capital Trust I,$25.9001,-0.0099,-0.038%,419035206.00,United States,,799,Consumer Discretionary,Department/Specialty Retail Stores
DE,Deere & Company Common Stock,$391.855,2.405,0.618%,107211456682.00,United States,,397230,Industrials,Industrial Machinery/Components
DEA,Easterly Government Properties Inc. Common Stock,$12.97,-0.12,-0.917%,1370525374.00,United States,2015,247508,Real Estate,Real Estate Investment Trusts
DEC,Diversified Energy Company plc Ordinary Shares,$13.57,0.20,1.496%,664294924.00,,,110792,,
DECK,Deckers Outdoor Corporation Common Stock,$178.90,0.56,0.314%,27178843653.00,United States,1993,201596,Consumer Discretionary,Shoe Manufacturing
DEI,Douglas Emmett Inc. Common Stock,$18.22,0.13,0.719%,3050670419.00,United States,2006,189008,Real Estate,Real Estate Investment Trusts
DELL,Dell Technologies Inc. Class C Common Stock ,$134.435,-0.095,-0.071%,94425091984.00,United States,2018,1087299,Technology,Computer Manufacturing
DEO,Diageo plc Common Stock,$120.56,1.41,1.183%,67064208863.00,United Kingdom,,306933,Consumer Staples,Beverages (Production/Distribution)
DESP,Despegar.com Corp. Ordinary Shares,$14.61,0.01,0.068%,1052711993.00,Argentina,2017,98566,Consumer Discretionary,Transportation Services
DFH,Dream Finders Homes Inc. Class A Common Stock,$29.06,0.42,1.466%,2716419331.00,United States,2022,57133,Consumer Discretionary,Homebuilding
DFIN,Donnelley Financial Solutions Inc. Common Stock ,$62.11,-0.13,-0.209%,1792385100.00,United States,2016,7711,Consumer Discretionary,Other Consumer Services
DFP,Flaherty & Crumrine Dynamic Preferred and Income Fund Inc. Common Stock,$20.3817,-0.0183,-0.09%,0.00,,2013,11593,Finance,Investment Managers
DFS,Discover Financial Services Common Stock,$174.975,0.325,0.186%,43931242712.00,United States,,115388,Finance,Finance: Consumer Services
DG,Dollar General Corporation Common Stock,$76.95,0.17,0.221%,16922473409.00,United States,2009,419305,Consumer Discretionary,Department/Specialty Retail Stores
DGX,Quest Diagnostics Incorporated Common Stock,$157.75,-2.80,-1.744%,17607294803.00,United States,,92273,Health Care,Medical Specialities
DHF,BNY Mellon High Yield Strategies Fund Common Stock,$2.57,-0.01,-0.388%,0.00,United States,1998,102251,Finance,Finance Companies
DHI,D.R. Horton Inc. Common Stock,$165.105,3.975,2.467%,53830850050.00,United States,,372710,Consumer Discretionary,Homebuilding
DHR,Danaher Corporation Common Stock,$238.68,-2.85,-1.18%,172392630654.00,United States,,415900,Industrials,Industrial Machinery/Components
DHT,DHT Holdings Inc.,$10.99,0.29,2.71%,1769384967.00,Jersey,2005,470887,Consumer Discretionary,Marine Transportation
DHX,DHI Group Inc. Common Stock,$1.67,0.04,2.454%,80834453.00,United States,2007,67700,Consumer Discretionary,Business Services
DIAX,Nuveen Dow 30SM Dynamic Overwrite Fund Common Shares of Beneficial Interest,$15.32,0.05,0.327%,0.00,,2014,14043,Finance,Finance Companies
DIN,Dine Brands Global Inc. Common Stock,$35.42,0.56,1.606%,540030074.00,United States,,100915,Consumer Discretionary,Restaurants
DINO,HF Sinclair Corporation Common Stock,$42.03,-0.39,-0.919%,7908022802.00,United States,1960,157596,Energy,Natural Gas Distribution
DIS,Walt Disney Company (The) Common Stock,$110.69,7.97,7.759%,200745987092.00,United States,,23278272,Consumer Discretionary,Services-Misc. Amusement & Recreation
DK,Delek US Holdings Inc. Common Stock,$18.76,-0.20,-1.055%,1185541295.00,United States,2017,99442,Energy,Integrated oil Companies
DKL,Delek Logistics Partners L.P. Common Units representing Limited Partner Interests,$38.865,0.045,0.116%,2000251896.00,United States,2012,23925,Energy,Natural Gas Distribution
DKS,Dick's Sporting Goods Inc Common Stock,$202.92,5.59,2.833%,16520269751.00,United States,2002,158161,Consumer Discretionary,Other Specialty Stores
DLB,Dolby Laboratories Common Stock,$73.03,-0.50,-0.68%,6963236908.00,United States,2005,37788,Miscellaneous,Multi-Sector Companies
DLNG,Dynagas LNG Partners LP Common Units,$4.025,-0.035,-0.862%,148272036.00,Greece,,4758,Consumer Discretionary,Marine Transportation
DLNG^A,Dynagas LNG Partners LP 9.00% Series A Cumulative Redeemable Preferred Units,$25.60,0.1149,0.451%,,Greece,,228,,
DLNG^B,Dynagas LNG Partners LP 8.75% Series B Fixed to Floating Rate Cumulative Redeemable Perpetual Preferred Units liquidation preference $25.00 per Uni,$26.71,0.06,0.225%,,Greece,,613,,
DLR,Digital Realty Trust Inc. Common Stock,$177.68,-0.45,-0.253%,58938695834.00,United States,2004,207718,Real Estate,Real Estate Investment Trusts
DLR^J,Digital Realty Trust Inc. 5.250% Series J Cumulative Redeemable Preferred Stock,$23.1311,-0.0889,-0.383%,,United States,,1029,,
DLR^K,Digital Realty Trust Inc. 5.850% Series K Cumulative Redeemable Preferred Stock par value $0.01 per share,$24.8825,-0.0375,-0.15%,,United States,,1246,,
DLR^L,Digital Realty Trust Inc. 5.200% Series L Cumulative Redeemable Preferred Stock,$23.12,-0.06,-0.259%,,United States,,5513,,
DLX,Deluxe Corporation Common Stock,$23.52,-0.60,-2.488%,1041283226.00,United States,,41527,Consumer Discretionary,Publishing
DLY,DoubleLine Yield Opportunities Fund Common Shares of Beneficial Interest,$16.12,0.03,0.186%,772885957.00,United States,2020,44819,Finance,Investment Managers
DM,Desktop Metal Inc. Class A Common Stock,$4.25,0.34,8.696%,141701031.00,United States,2019,213679,Technology,Industrial Machinery/Components
DMA,Destra Multi-Alternative Fund Common Stock,$8.89,0.00,0.00%,0.00,,2022,16,Finance,Trusts Except Educational Religious and Charitable
DMB,BNY Mellon Municipal Bond Infrastructure Fund Inc. Common Stock,$10.75,0.07,0.655%,0.00,,2013,9855,Finance,Trusts Except Educational Religious and Charitable
DMO,Western Asset Mortgage Opportunity Fund Inc. Common Stock,$12.00,-0.025,-0.208%,0.00,United States,2010,19116,Finance,Trusts Except Educational Religious and Charitable
DNA,Ginkgo Bioworks Holdings Inc. Class A Common Stock,$7.80,-0.80,-9.302%,433488003.00,United States,2021,478903,Health Care,Biotechnology: Biological Products (No Diagnostic Substances)
DNB,Dun & Bradstreet Holdings Inc. Common Stock,$12.375,-0.055,-0.442%,5463877320.00,United States,2020,134559,Finance,Finance: Consumer Services
DNMR,Danimer Scientific Inc. Common Stock,$9.7501,-0.7399,-7.053%,29438389.00,United States,2020,25014,Industrials,Major Chemicals
DNOW,DNOW Inc. Common Stock,$14.70,-0.16,-1.077%,1555938479.00,United States,2014,63161,Industrials,Metal Fabrications
DNP,DNP Select Income Fund Inc. Common Stock,$9.355,0.015,0.161%,0.00,United States,1987,89586,Finance,Investment Managers
DOC,Healthpeak Properties Inc. Common Stock,$21.30,-0.35,-1.617%,14898135453.00,United States,,468536,Real Estate,Real Estate Investment Trusts
DOCN,DigitalOcean Holdings Inc. Common Stock,$38.15,0.09,0.236%,3520569211.00,United States,2021,177741,Technology,Computer Software: Programming Data Processing
DOCS,Doximity Inc. Class A Common Stock,$52.625,-0.235,-0.445%,9824653923.00,United States,2021,526741,Technology,EDP Services
DOLE,Dole plc Ordinary Shares,$14.73,-0.25,-1.669%,1398306807.00,Ireland,2021,168353,Consumer Staples,Farming/Seeds/Milling
DOUG,Douglas Elliman Inc. Common Stock,$1.81,0.01,0.556%,166217035.00,United States,2021,145972,Finance,Real Estate
DOV,Dover Corporation Common Stock,$203.145,-0.845,-0.414%,27869861933.00,United States,,85845,Industrials,Industrial Machinery/Components
DOW,Dow Inc. Common Stock ,$44.765,-0.225,-0.50%,31339604503.00,United States,2019,895352,Industrials,Major Chemicals
DPG,Duff & Phelps Utility and Infrastructure Fund Inc.,$11.7233,0.0033,0.028%,0.00,United States,2011,13383,Finance,Trusts Except Educational Religious and Charitable
DPZ,Domino's Pizza Inc Common Stock,$440.515,0.965,0.22%,15211854289.00,United States,2004,85535,Consumer Discretionary,Food Distributors
DQ,DAQO New Energy Corp. American Depositary Shares each representing five ordinary shares,$19.705,-1.035,-4.99%,1300676822.00,China,2010,788143,Technology,Semiconductors
DRD,DRDGOLD Limited American Depositary Shares,$9.44,-0.12,-1.255%,816171742.00,South Africa,,114408,Basic Materials,Precious Metals
DRH,Diamondrock Hospitality Company Common Stock,$9.325,0.075,0.811%,1935797358.00,United States,2005,121701,Real Estate,Real Estate Investment Trusts
DRH^A,Diamondrock Hospitality Company 8.250% Series A Cumulative Redeemable Preferred Stock,$25.75,-0.0116,-0.045%,,United States,,625,,
DRI,Darden Restaurants Inc. Common Stock,$169.145,-0.535,-0.315%,19874618013.00,United States,,97983,Consumer Discretionary,Restaurants
DSL,DoubleLine Income Solutions Fund Common Shares of Beneficial Interests,$12.53,-0.08,-0.634%,1278020255.00,United States,2013,114657,Finance,Trusts Except Educational Religious and Charitable
DSM,BNY Mellon Strategic Municipal Bond Fund Inc. Common Stock,$6.02,0.02,0.333%,0.00,United States,1989,10570,Finance,Investment Managers
DSU,Blackrock Debt Strategies Fund Inc. Common Stock,$10.85,-0.01,-0.092%,0.00,United States,1998,34846,Finance,Finance Companies
DSX,Diana Shipping inc. common stock,$2.195,0.005,0.228%,263318603.00,Greece,2005,45752,Consumer Discretionary,Marine Transportation
DSX^B,Diana Shipping Inc. Perpetual Preferred Shares Series B (Marshall Islands),$26.2543,-0.1902,-0.719%,,Greece,,291,,
DT,Dynatrace Inc. Common Stock,$53.57,-0.07,-0.13%,15989789005.00,United States,2019,439462,Technology,Computer Software: Prepackaged Software
DTB,DTE Energy Company 2020 Series G 4.375% Junior Subordinated Debentures due 2080,$19.71,-0.14,-0.705%,4081952550.00,United States,2020,1091,Utilities,Electric Utilities: Central
DTC,Solo Brands Inc. Class A Common Stock,$1.145,-0.035,-2.966%,104963993.00,United States,2021,120235,Consumer Discretionary,Recreational Games/Products/Toys
DTE,DTE Energy Company Common Stock,$119.64,1.02,0.86%,24777514109.00,United States,,125687,Utilities,Electric Utilities: Central
DTF,DTF Tax-Free Income 2028 Term Fund Inc. Common Stock,$11.25,-0.08,-0.706%,79082629.00,United States,1991,2002,Finance,Investment Managers
DTG,DTE Energy Company 2021 Series E 4.375% Junior Subordinated Debentures,$19.66,-0.05,-0.254%,4071597521.00,United States,2021,3929,Utilities,Electric Utilities: Central
DTM,DT Midstream Inc. Common Stock ,$99.135,0.935,0.952%,9631574335.00,United States,2021,46826,Utilities,Natural Gas Distribution
DTW,DTE Energy Company 2017 Series E 5.25% Junior Subordinated Debentures due 2077,$23.4798,-0.1702,-0.72%,4862680339.00,United States,2017,16291,Utilities,Electric Utilities: Central
DUK,Duke Energy Corporation (Holding Company) Common Stock,$110.8675,-0.4425,-0.398%,85643193036.00,United States,,333978,Utilities,Power Generation
DUK^A,Duke Energy Corporation Depositary Shares each representing a 1/1000th interest in a share of 5.75% Series A Cumulative Redeemable Perpetual Preferred Stock,$25.15,-0.04,-0.159%,,United States,,10761,,
DUKB,Duke Energy Corporation 5.625% Junior Subordinated Debentures due 2078,$24.85,0.00,0.00%,19196187764.00,United States,2018,3674,Utilities,Power Generation
DV,DoubleVerify Holdings Inc. Common Stock,$20.35,0.02,0.098%,3442507933.00,United States,2021,142988,Technology,Computer Software: Programming Data Processing
DVA,DaVita Inc. Common Stock,$156.2275,-1.0525,-0.669%,12810655000.00,United States,,76723,Health Care,Misc Health and Biotechnology Services
DVN,Devon Energy Corporation Common Stock,$39.25,0.14,0.358%,25783325000.00,United States,1985,831863,Energy,Oil & Gas Production
DX,Dynex Capital Inc. Common Stock,$12.415,0.035,0.283%,984553250.00,United States,,399347,Real Estate,Real Estate Investment Trusts
DX^C,Dynex Capital Inc. 6.900% Series C Fixed-to-Floating Rate Cumulative Redeemable Preferred Stock,$25.2221,0.0346,0.137%,,United States,,17170,,
DXC,DXC Technology Company Common Stock ,$22.015,-0.395,-1.763%,3985254081.00,United States,,100123,Technology,EDP Services
DXYZ,Destiny Tech100 Inc. Common Stock,$28.7603,-4.2497,-12.874%,0.00,,2024,1754635,,
DY,Dycom Industries Inc. Common Stock,$186.835,0.745,0.40%,5437672557.00,United States,,36570,Industrials,Water Sewer Pipeline Comm & Power Line Construction
E,ENI S.p.A. Common Stock,$29.62,0.48,1.647%,49997640210.00,Italy,,63273,Energy,Oil & Gas Production
EAF,GrafTech International Ltd. Common Stock,$2.155,0.005,0.233%,554195159.00,United States,2018,283988,Energy,Industrial Machinery/Components
EAI,Entergy Arkansas LLC First Mortgage Bonds 4.875% Series Due September 1 2066,$22.01,-0.06,-0.272%,4719120388.00,United States,2016,2922,Utilities,Electric Utilities: Central
EARN,Ellington Credit Company Common Shares of Beneficial Interest,$6.335,-0.035,-0.549%,160446488.00,United States,2013,69792,Real Estate,Real Estate Investment Trusts
EAT,Brinker International Inc. Common Stock,$118.19,-0.46,-0.388%,5250955839.00,United States,,76425,Consumer Discretionary,Restaurants
EB,Eventbrite Inc. Class A Common Stock,$3.695,0.105,2.925%,357974848.00,United States,2018,409158,Technology,Computer Software: Programming Data Processing
EBF,Ennis Inc. Common Stock,$21.47,-0.24,-1.105%,558302745.00,United States,,17457,Consumer Discretionary,Office Equipment/Supplies/Services
EBR,Centrais Electricas Brasileiras S A American Depositary Shares (Each representing one Common Share),$6.225,0.085,1.384%,13980193905.00,Brazil,2016,99782,Utilities,Electric Utilities: Central
EBS,Emergent BioSolutions Inc. Common Stock,$9.45,-0.52,-5.216%,512040558.00,United States,2006,398581,Health Care,Biotechnology: Pharmaceutical Preparations
EC,Ecopetrol S.A. American Depositary Shares,$7.685,0.325,4.416%,15799089938.00,Colombia,,1554459,Energy,Oil & Gas Production
ECAT,BlackRock ESG Capital Allocation Term Trust Common Shares of Beneficial Interest,$17.74,0.07,0.396%,1918314900.00,United States,2021,64553,Finance,Trusts Except Educational Religious and Charitable
ECC           ,Eagle Point Credit Company Inc. Common Stock,$9.22,-0.19,-2.019%,559308471.00,United States,2014,1852987,Finance,Trusts Except Educational Religious and Charitable
ECC^D,Eagle Point Credit Company Inc. 6.75% Series D Preferred Stock,$19.9595,-0.0605,-0.302%,,United States,,8845,,
ECCC,Eagle Point Credit Company Inc. 6.50% Series C Term Preferred Stock due 2031,$23.75,0.15,0.636%,1440734945.00,United States,,800,Finance,Trusts Except Educational Religious and Charitable
ECCF,Eagle Point Credit Company Inc. 8.00% Series F Term Preferred Stock due 2029,$24.85,-0.035,-0.141%,27053519776.00,United States,,1537,,
ECCV,Eagle Point Credit Company Inc. 5.375% Notes due 2029,$23.0174,-0.0026,-0.011%,1396293580.00,United States,2022,321,Finance,Trusts Except Educational Religious and Charitable
ECCW,Eagle Point Credit Company Inc. 6.75% Notes due 2031,$24.55,0.02,0.082%,1489264964.00,United States,2021,950,Finance,Trusts Except Educational Religious and Charitable
ECCX,Eagle Point Credit Company Inc. 6.6875% Notes due 2028,$24.65,-0.01,-0.041%,1495331217.00,United States,2022,705,Finance,Trusts Except Educational Religious and Charitable
ECG,Everus Construction Group Inc. Common Stock,$58.18,-1.04,-1.756%,2965554393.00,United States,2024,27669,Consumer Discretionary,Homebuilding
ECL,Ecolab Inc. Common Stock,$249.29,-0.61,-0.244%,70589409360.00,United States,,106745,Consumer Discretionary,Package Goods/Cosmetics
ECO,Okeanis Eco Tankers Corp. Common Stock,$24.7016,0.7316,3.052%,0.00,,,55683,Consumer Discretionary,Marine Transportation
ECVT,Ecovyst Inc. Common Stock,$8.0801,-0.0999,-1.221%,941410859.00,United States,2017,65908,Industrials,Major Chemicals
ED,Consolidated Edison Inc. Common Stock,$95.70,0.29,0.304%,33151646583.00,United States,,179118,Utilities,Power Generation
EDD,Morgan Stanley Emerging Markets Domestic Debt Fund Inc. Common Stock,$4.64,-0.03,-0.642%,0.00,United States,2007,37261,Finance,Finance Companies
EDF,Virtus Stone Harbor Emerging Markets Income Fund Common Shares of Beneficial Interest,$4.93,-0.01,-0.202%,0.00,United States,2010,14687,Finance,Investment Managers
EDN,Empresa Distribuidora Y Comercializadora Norte S.A. (Edenor) American Depositary Shares,$33.255,-0.215,-0.642%,1507208218.00,Argentina,2007,18184,Utilities,Electric Utilities: Central
EDR,Endeavor Group Holdings Inc. Class A Common Stock,$28.955,0.115,0.399%,19809867538.00,United States,2021,106236,Consumer Discretionary,Services-Misc. Amusement & Recreation
EDU,New Oriental Education & Technology Group Inc. Sponsored ADR representing 10 Ordinary Share (Cayman Islands),$54.315,-1.085,-1.958%,8882068564.00,China,2006,902813,Real Estate,Other Consumer Services
EE,Excelerate Energy Inc. Class A Common Stock,$26.825,0.075,0.28%,2851081498.00,United States,2022,20814,Utilities,Oil/Gas Transmission
EEA,The European Equity Fund Inc. Common Stock,$8.50,0.00,0.00%,0.00,United States,,9323,Finance,Trusts Except Educational Religious and Charitable
EEX,Emerald Holding Inc. Common Stock,$4.65,-0.02,-0.428%,943877860.00,United States,2017,1386,Consumer Discretionary,Business Services
EFC,Ellington Financial Inc. Common Stock ,$12.225,0.015,0.123%,1062719825.00,United States,2010,133951,Finance,Real Estate
EFC^A,Ellington Financial Inc. 6.750% Series A Fixed-to-Floating Rate Cumulative Redeemable Preferred Stock,$25.475,0.275,1.091%,,United States,,4437,,
EFC^B,Ellington Financial Inc. 6.250% Series B Fixed-Rate Reset Cumulative Redeemable Preferred Stock,$22.80,0.15,0.662%,,United States,,1332,,
EFC^C,Ellington Financial Inc. 8.625% Series C Fixed-Rate Reset Cumulative Redeemable Preferred Stock,$25.425,-0.045,-0.177%,,United States,,2403,,
EFC^D,Ellington Financial Inc. 7.00% Series D Cumulative Perpetual Redeemable Preferred Stock,$22.735,0.405,1.814%,,United States,,267,,
EFC^E,Ellington Financial Inc. 8.250% Series E Fixed-to-Floating Rate Cumulative Redeemable Preferred Stock,$25.4102,-0.0098,-0.039%,,United States,,1301,,
EFR,Eaton Vance Senior Floating-Rate Fund Common Shares of Beneficial Interest,$12.85,-0.04,-0.31%,0.00,United States,2003,7764,Finance,Trusts Except Educational Religious and Charitable
EFT,Eaton Vance Floating Rate Income Trust Common Shares of Beneficial Interest,$13.23,0.03,0.227%,384866190.00,United States,2004,17017,Finance,Finance Companies
EFX,Equifax Inc. Common Stock,$267.22,1.25,0.47%,33122457448.00,United States,,76150,Finance,Finance: Consumer Services
EFXT,Enerflex Ltd Common Shares,$7.76,0.18,2.375%,962587733.00,Canada,2022,67481,Industrials,Industrial Machinery/Components
EG,Everest Group Ltd. Common Stock,$368.77,-1.91,-0.515%,15849212790.00,Bermuda,,38461,Finance,Property-Casualty Insurers
EGF,Blackrock Enhanced Government Fund Inc. Common Stock,$9.86,0.11,1.128%,0.00,United States,2005,100,Finance,Trusts Except Educational Religious and Charitable
EGY,VAALCO Energy Inc.  Common Stock,$5.3043,0.0043,0.081%,550284860.00,United States,,109274,Energy,Oil & Gas Production
EHAB,Enhabit Inc. Common Stock,$7.03,-0.58,-7.622%,353497364.00,United States,2022,147026,Health Care,Medical/Nursing Services
EHC,Encompass Health Corporation Common Stock,$102.62,-0.07,-0.068%,10338918411.00,United States,,54493,Health Care,Hospital/Nursing Management
EHI,Western Asset Global High Income Fund Inc Common Stock,$6.64,0.018,0.272%,0.00,United States,2003,21296,Finance,Investment Managers
EIC,Eagle Point Income Company Inc. Common Stock,$16.0667,-0.1033,-0.639%,143123899.00,,2019,32385,Finance,Finance/Investors Services
EICA,Eagle Point Income Company Inc. 5.00% Series A Term Preferred Stock due 2026,$23.85,0.00,0.00%,212458376.00,,2021,90,Finance,Finance/Investors Services
EICB,Eagle Point Income Company Inc. 7.75% Series B Term Preferred Stock Due 2028,$25.00,-0.03,-0.12%,0.00,,,674,,
EICC,Eagle Point Income Company Inc. 8.00% Series C Term Preferred Stock due 2029,$25.15,-0.0068,-0.027%,0.00,,,946,,
EIG,Employers Holdings Inc Common Stock,$53.19,-0.10,-0.188%,1314649572.00,United States,2007,5430,Finance,Property-Casualty Insurers
EIIA,Eagle Point Institutional Income Fund 8.125% Series A Term Preferred Shares Due 2029,$25.02,-0.12,-0.477%,0.00,,2024,7302,,
EIX,Edison International Common Stock,$82.66,0.48,0.584%,32001841236.00,United States,,273832,Utilities,Electric Utilities: Central
EL,Estee Lauder Companies Inc. (The) Common Stock,$63.93,1.07,1.702%,22949465202.00,United States,1995,686013,Consumer Discretionary,Package Goods/Cosmetics
ELAN,Elanco Animal Health Incorporated Common Stock,$13.99,-0.20,-1.409%,6915995784.00,United States,2018,317596,Health Care,Biotechnology: Pharmaceutical Preparations
ELC,Entergy Louisiana Inc. Collateral Trust Mortgage Bonds 4.875 % Series due September 1 2066,$21.9964,0.0364,0.166%,4690458489.00,United States,2016,3015,Utilities,Electric Utilities: Central
ELF,e.l.f. Beauty Inc. Common Stock,$122.325,-0.635,-0.516%,6890694223.00,United States,2016,330632,Consumer Discretionary,Package Goods/Cosmetics
ELME,Elme Communities Common Stock,$16.76,-0.23,-1.354%,1475052259.00,United States,2000,82723,Real Estate,Real Estate Investment Trusts
ELP,Companhia Paranaense de Energia (COPEL) American Depositary Shares (each representing one Unit consisting one Common Share and four non-voting Class B Preferred Shares),$6.59,0.13,2.012%,2142322177.00,Brazil,2021,18578,Utilities,Electric Utilities: Central
ELPC,Companhia Paranaense de Energia (COPEL) American Depositary Shares (each representing four (4) Common Shares),$5.86,0.14,2.448%,1905008795.00,Brazil,2023,2303,Utilities,Electric Utilities: Central
ELS,Equity Lifestyle Properties Inc. Common Stock,$72.96,0.51,0.704%,13938951602.00,United States,,188700,Real Estate,Real Estate Investment Trusts
ELV,Elevance Health Inc. Common Stock,$413.12,2.23,0.543%,95811953333.00,United States,,179538,Health Care,Medical Specialities
EMD,Western Asset Emerging Markets Debt Fund Inc Common Stock,$9.6793,-0.0007,-0.007%,0.00,United States,,40866,Finance,Finance/Investors Services
EME,EMCOR Group Inc. Common Stock,$498.66,-1.70,-0.34%,22939386741.00,United States,,58306,Industrials,Engineering & Construction
EMF,Templeton Emerging Markets Fund Common Stock,$12.645,-0.045,-0.355%,0.00,United States,1987,422,Finance,Finance/Investors Services
EMN,Eastman Chemical Company Common Stock,$100.715,-0.055,-0.055%,11674137106.00,United States,,112314,Industrials,Major Chemicals
EMO,ClearBridge Energy Midstream Opportunity Fund Inc. Common Stock,$46.61,-0.03,-0.064%,0.00,United States,2011,6788,Finance,Investment Managers
EMP,Entergy Mississippi LLC First Mortgage Bonds 4.90% Series Due October 1 2066,$21.8496,-0.1904,-0.864%,4684729343.00,United States,2016,2676,Utilities,Electric Utilities: Central
EMR,Emerson Electric Company Common Stock,$130.00,-0.16,-0.123%,74126000000.00,United States,,608813,Technology,Consumer Electronics/Appliances
ENB,Enbridge Inc Common Stock,$42.88,0.39,0.918%,91166771532.00,Canada,,1239987,Energy,Natural Gas Distribution
ENFN,Enfusion Inc. Class A Common Stock,$9.9599,0.2699,2.785%,1280552689.00,United States,2021,74095,Technology,Computer Software: Prepackaged Software
ENIC,Enel Chile S.A. American Depositary Shares (Each representing 50 shares of Common Stock),$2.701,-0.019,-0.699%,3736377420.00,Chile,2016,14997,Utilities,Electric Utilities: Central
ENJ,Entergy New Orleans LLC First Mortgage Bonds 5.0% Series due December 1 2052,$22.44,0.00,0.00%,4811315834.00,United States,,102,Utilities,Power Generation
ENLC,EnLink Midstream LLC Common Units representing Limited Partner Interests,$15.265,0.055,0.362%,6977220581.00,United States,,258708,Utilities,Natural Gas Distribution
ENO,Entergy New Orleans LLC First Mortgage Bonds 5.50% Series due April 1 2066,$24.4174,-0.1026,-0.418%,5221193299.00,United States,2016,1200,Utilities,Power Generation
ENOV,Enovis Corporation Common Stock,$46.31,-0.14,-0.301%,2587592367.00,United States,,36292,Health Care,Industrial Specialties
ENR,Energizer Holdings Inc. Common Stock,$33.73,0.36,1.079%,2421682757.00,United States,2015,32079,Miscellaneous,Industrial Machinery/Components
ENS,EnerSys Common Stock,$97.61,-0.35,-0.357%,3886845720.00,United States,2004,21239,Technology,Industrial Machinery/Components
ENV,Envestnet Inc Common Stock,$62.985,0.015,0.024%,3485963023.00,United States,2010,149606,Consumer Discretionary,Business Services
